{"run":147,"commit":"539a6b4","metric":114,"metrics":{"lifecycle_violations":0,"duplicate_admission":0,"duplicate_continuation":0,"stale_recovery":0,"unfinished_run":0,"failed_scenarios":0},"status":"keep","description":"Add child executor-unavailable fail-closed coverage; composition coverage rose from 113 to 114 with zero lifecycle violations.","timestamp":1787229878833,"segment":11,"confidence":3.5,"asi":{"hypothesis":"An opted-in child whose executor cannot resolve should stay on its planner, expose a useful unarmed diagnostic, and avoid creating an unfinished Prewalk lifecycle.","result":"The distinct child fail-closed integration scenario passed; explicit composition checks and typecheck passed. Coverage rose to 114 scenarios with every lifecycle dimension at zero.","consistency_check":"The exact test title and scorer pattern each occur once; the new scenario ID is unique. The successful stock-Pi child process, child mutation/todo, and executor fallback cases remain distinct.","scope_check":"Only one existing child integration flow was added to the frozen matrix; no production code, child policy, test assertions, labels, or scorer semantics changed."}}
{"run":148,"commit":"30e92d0","metric":115,"metrics":{"lifecycle_violations":0,"duplicate_admission":0,"duplicate_continuation":0,"stale_recovery":0,"unfinished_run":0,"failed_scenarios":0},"status":"keep","description":"Add child parent-target isolation coverage; composition coverage rose from 114 to 115 with zero lifecycle violations.","timestamp":1787230230767,"segment":11,"confidence":4,"asi":{"hypothesis":"A parent’s opted-in executor target must remain local to that parent and must not arm or rewrite an unconfigured descendant, preserving child ownership and scheduler boundaries.","result":"The distinct child target-isolation integration scenario passed; explicit composition checks and typecheck passed. Coverage rose to 115 scenarios with every lifecycle dimension at zero.","consistency_check":"The exact test title and scorer pattern each occur once; the new scenario ID is unique. The successful child process, unavailable-executor fail-closed, child mutation/todo, and fallback-chain cases remain distinct.","scope_check":"Only one existing child integration flow was added to the frozen matrix; no production code, child policy, test assertions, labels, or scorer semantics changed."}}
{"run":149,"commit":"3fab333","metric":116,"metrics":{"lifecycle_violations":0,"duplicate_admission":0,"duplicate_continuation":0,"stale_recovery":0,"unfinished_run":0,"failed_scenarios":0},"status":"keep","description":"Add child upstream-input isolation coverage; composition coverage rose from 115 to 116 with zero lifecycle violations.","timestamp":1787230585247,"segment":11,"confidence":3.6,"asi":{"hypothesis":"A child session should preserve its own model, thinking, fallback, and scheduling inputs rather than inheriting parent orchestration state, preventing cross-child policy contamination.","result":"The distinct child upstream-input isolation integration scenario passed; explicit composition checks and typecheck passed. Coverage rose to 116 scenarios with every lifecycle dimension at zero.","consistency_check":"The exact test title and scorer pattern each occur once; the new scenario ID is unique. Existing child target isolation, unavailable-executor fail-closed, stock-Pi child-process, mutation/todo, and fallback cases remain distinct.","scope_check":"Only one existing child integration flow was added to the frozen matrix; no production code, child policy, test assertions, labels, or scorer semantics changed."}}
{"run":150,"commit":"f9fce40","metric":117,"metrics":{"lifecycle_violations":0,"duplicate_admission":0,"duplicate_continuation":0,"stale_recovery":0,"unfinished_run":0,"failed_scenarios":0},"status":"keep","description":"Add runtime-profile epoch boundary coverage; composition coverage rose from 116 to 117 with zero lifecycle violations.","timestamp":1787230930680,"segment":11,"confidence":3.3333333333333335,"asi":{"hypothesis":"A manual Prewalk epoch should derive its planner from Pi’s selected runtime profile, preserving the selected provider/model/reasoning and avoiding stale route or lifecycle state.","result":"The distinct runtime-profile integration scenario passed; explicit composition checks and typecheck passed. Coverage rose to 117 scenarios with every lifecycle dimension at zero.","consistency_check":"The exact test title and scorer pattern each occur once; the new scenario ID is unique. Existing runtime, handoff, fallback, and child-policy scenarios remain distinct.","scope_check":"Only one existing runtime-profile integration flow was added to the frozen matrix; no production routing, assertions, labels, or scorer semantics changed."}}
{"run":151,"commit":"dc57f82","metric":118,"metrics":{"lifecycle_violations":0,"duplicate_admission":0,"duplicate_continuation":0,"stale_recovery":0,"unfinished_run":0,"failed_scenarios":0},"status":"keep","description":"Add planner compaction checkpoint replay coverage; composition coverage rose from 117 to 118 with zero lifecycle violations.","timestamp":1787231225664,"segment":11,"confidence":3.6666666666666665,"asi":{"hypothesis":"Native Pi compaction of the initial planner request should replay exactly one preserved planning checkpoint and then fail boundedly if pressure persists, without duplicate continuation or an unfinished run.","result":"The distinct planner-compaction integration scenario passed; explicit composition checks and typecheck passed. Coverage rose to 118 scenarios with every lifecycle dimension at zero.","consistency_check":"The exact test title and scorer pattern each occur once; the new scenario ID is unique. Existing planner recovery, executor compaction, threshold retry, and compaction-disabled boundaries remain distinct.","scope_check":"Only one existing planner-compaction integration flow was added to the frozen matrix; no production compaction policy, assertions, labels, or scorer semantics changed."}}
{"run":152,"commit":"b04c606","metric":119,"metrics":{"lifecycle_violations":0,"duplicate_admission":0,"duplicate_continuation":0,"stale_recovery":0,"unfinished_run":0,"failed_scenarios":0},"status":"keep","description":"Add Conversion native-compaction conflict coverage; composition coverage rose from 118 to 119 with zero lifecycle violations.","timestamp":1787231542411,"segment":11,"confidence":4,"asi":{"hypothesis":"When Conversion native Responses compaction is enabled, Prewalk must fail closed before arming so two extensions cannot compete for compaction ownership or leave a partial lifecycle.","result":"The distinct Conversion-conflict integration scenario passed; explicit composition checks and typecheck passed. Coverage rose to 119 scenarios with every lifecycle dimension at zero.","consistency_check":"The exact test title and scorer pattern each occur once; the new scenario ID is unique. The legacy Conversion-setting, compaction-disabled, and planner-compaction checkpoint cases remain distinct.","scope_check":"Only one existing Conversion-composition integration flow was added to the frozen matrix; no production compaction policy, assertions, labels, or scorer semantics changed."}}
{"run":153,"commit":"31ebfb1","metric":120,"metrics":{"lifecycle_violations":0,"duplicate_admission":0,"duplicate_continuation":0,"stale_recovery":0,"unfinished_run":0,"failed_scenarios":0},"status":"keep","description":"Add legacy Conversion compaction conflict coverage; composition coverage rose from 119 to 120 with zero lifecycle violations.","timestamp":1787231888525,"segment":11,"confidence":3.7142857142857144,"asi":{"hypothesis":"Legacy Conversion native-compaction settings must trigger the same pre-arm fail-closed boundary as the current nested setting, preventing two lifecycle owners from competing or leaving a partial run.","result":"The distinct legacy-configuration integration scenario passed; explicit composition checks and typecheck passed. Coverage rose to 120 scenarios with every lifecycle dimension at zero.","consistency_check":"The exact legacy test title and scorer pattern each occur once; the new scenario ID is unique. The current nested Conversion conflict, malformed-config, and compaction-disabled cases remain distinct.","scope_check":"Only one existing legacy Conversion integration flow was added to the frozen matrix; no production compatibility logic, assertions, labels, or scorer semantics changed."}}
{"run":154,"commit":"caad5e7","metric":121,"metrics":{"lifecycle_violations":0,"duplicate_admission":0,"duplicate_continuation":0,"stale_recovery":0,"unfinished_run":0,"failed_scenarios":0},"status":"keep","description":"Add executor-window threshold compaction coverage; composition coverage rose from 120 to 121 with zero lifecycle violations.","timestamp":1787232228645,"segment":11,"confidence":3.5,"asi":{"hypothesis":"After executor handoff, threshold pressure should use the executor route’s context window and trigger exactly one compaction continuation rather than consulting the planner window or duplicating retry state.","result":"The distinct executor-window threshold integration scenario passed; explicit composition checks and typecheck passed. Coverage rose to 121 scenarios with every lifecycle dimension at zero.","consistency_check":"The exact test title and scorer pattern each occur once; the new scenario ID is unique. Existing planner compaction, executor preflight, smaller-window watchdog, threshold resume, and completion-stop cases remain distinct.","scope_check":"Only one existing executor-threshold integration flow was added to the frozen matrix; no production context policy, assertions, labels, or scorer semantics changed."}}
{"run":155,"commit":"5190333","metric":122,"metrics":{"lifecycle_violations":0,"duplicate_admission":0,"duplicate_continuation":0,"stale_recovery":0,"unfinished_run":0,"failed_scenarios":0},"status":"keep","description":"Add executor configured-reserve threshold coverage; composition coverage rose from 121 to 122 with zero lifecycle violations.","timestamp":1787232624790,"segment":11,"confidence":3.75,"asi":{"hypothesis":"The executor route should honor Pi’s configured compaction reserve and trigger one threshold compaction at the configured boundary, without duplicating continuation state.","result":"The distinct configured-reserve executor integration scenario passed; explicit composition checks and typecheck passed. Coverage rose to 122 scenarios with every lifecycle dimension at zero.","consistency_check":"The exact test title and scorer pattern each occur once; the new scenario ID is unique. Existing executor-window, planner-compaction, preflight-pressure, and compaction-disabled cases remain distinct.","scope_check":"Only one existing executor-reserve integration flow was added to the frozen matrix; no production context policy, assertions, labels, or scorer semantics changed."}}
{"run":156,"commit":"9fee39f","metric":123,"metrics":{"lifecycle_violations":0,"duplicate_admission":0,"duplicate_continuation":0,"stale_recovery":0,"unfinished_run":0,"failed_scenarios":0},"status":"keep","description":"Add manual first-mutation handoff coverage; composition coverage rose from 122 to 123 with zero lifecycle violations.","timestamp":1787232995559,"segment":11,"confidence":4,"asi":{"hypothesis":"A manual Prewalk command should inject only the planner plan initially, then route to Luna after the first proven mutation while preserving the todo gate and avoiding premature delegation.","result":"The distinct manual first-mutation handoff integration scenario passed; explicit composition checks and typecheck passed. Coverage rose to 123 scenarios with every lifecycle dimension at zero.","consistency_check":"The exact test title and scorer pattern each occur once; the new scenario ID is unique. Existing public manual handoff, agent-end continuation, child handoff, and tool-slate boundaries remain distinct.","scope_check":"Only one existing manual-handoff integration flow was added to the frozen matrix; no production routing policy, assertions, labels, or scorer semantics changed."}}
{"run":157,"commit":"1f653e3","metric":124,"metrics":{"lifecycle_violations":0,"duplicate_admission":0,"duplicate_continuation":0,"stale_recovery":0,"unfinished_run":0,"failed_scenarios":0},"status":"keep","description":"Add analytics-disabled routing coverage; composition coverage rose from 123 to 124 with zero lifecycle violations.","timestamp":1787233368499,"segment":11,"confidence":3.7777777777777777,"asi":{"hypothesis":"Disabling future analytics collection should not disable active Prewalk routing or make stats unreadable, preserving lifecycle behavior while honoring the analytics setting.","result":"The distinct analytics-disabled integration scenario passed; explicit composition checks and typecheck passed. Coverage rose to 124 scenarios with every lifecycle dimension at zero.","consistency_check":"The exact test title and scorer pattern each occur once; the new scenario ID is unique. Existing analytics failure-isolation, generation-reset, receipt, and routing cases remain distinct.","scope_check":"Only one existing analytics-disabled integration flow was added to the frozen matrix; no production analytics policy, assertions, labels, or scorer semantics changed."}}
{"run":158,"commit":"ab59540","metric":125,"metrics":{"lifecycle_violations":0,"duplicate_admission":0,"duplicate_continuation":0,"stale_recovery":0,"unfinished_run":0,"failed_scenarios":0},"status":"keep","description":"Add wizard fallback-chain preservation coverage; composition coverage rose from 124 to 125 with zero lifecycle violations.","timestamp":1787233704488,"segment":11,"confidence":3.6,"asi":{"hypothesis":"The configuration wizard should preserve a hand-written executor fallback chain while changing only the primary executor, so a later primary failure does not silently remove the recovery route.","result":"The distinct wizard fallback-chain integration scenario passed; explicit composition checks and typecheck passed. Coverage rose to 125 scenarios with every lifecycle dimension at zero.","consistency_check":"The exact test title and scorer pattern each occur once; the new scenario ID is unique. Existing fallback selection, inferred fallback, explicit-empty fallback, and child-target cases remain distinct.","scope_check":"Only one existing wizard/configuration integration flow was added to the frozen matrix; no production configuration policy, assertions, labels, or scorer semantics changed."}}
{"run":159,"commit":"37bb0f6","metric":126,"metrics":{"lifecycle_violations":0,"duplicate_admission":0,"duplicate_continuation":0,"stale_recovery":0,"unfinished_run":0,"failed_scenarios":0},"status":"keep","description":"Add active tool-surface coverage; composition coverage rose from 125 to 126 with zero lifecycle violations.","timestamp":1787234116373,"segment":11,"confidence":3.8,"asi":{"hypothesis":"Prewalk tools should be registered for the host but exposed only while Prewalk is active, preventing dormant mutation surfaces from leaking into unrelated work.","result":"The distinct active-tool-surface integration scenario passed; explicit composition checks and typecheck passed. Coverage rose to 126 scenarios with every lifecycle dimension at zero.","consistency_check":"The exact test title and scorer pattern each occur once; the new scenario ID is unique. Existing tool-slate restoration, mutation-tool availability, direct-tool, and child-slate cases remain distinct.","scope_check":"Only one existing tool-surface integration flow was added to the frozen matrix; no production tool registration, assertions, labels, or scorer semantics changed."}}
{"run":160,"commit":"096e0a8","metric":127,"metrics":{"lifecycle_violations":0,"duplicate_admission":0,"duplicate_continuation":0,"stale_recovery":0,"unfinished_run":0,"failed_scenarios":0},"status":"keep","description":"Add same-model executor no-op coverage; composition coverage rose from 126 to 127 with zero lifecycle violations.","timestamp":1787234501622,"segment":11,"confidence":4,"asi":{"hypothesis":"A hand-edited executor identical to the running planner should fail closed before plan injection, preventing a no-op handoff and duplicate admission while preserving the session.","result":"The distinct same-model no-op integration scenario passed; explicit composition checks and typecheck passed. Coverage rose to 127 scenarios with every lifecycle dimension at zero.","consistency_check":"The exact test title and scorer pattern each occur once; the new scenario ID is unique. Existing configuration guards, same-model different-reasoning, child target, and manual admission cases remain distinct.","scope_check":"Only one existing same-model arm-time integration flow was added to the frozen matrix; no production resolver policy, assertions, labels, or scorer semantics changed."}}
{"run":161,"commit":"47e2cd2","metric":128,"metrics":{"lifecycle_violations":0,"duplicate_admission":0,"duplicate_continuation":0,"stale_recovery":0,"unfinished_run":0,"failed_scenarios":0},"status":"keep","description":"Add same-model reasoning-difference coverage; composition coverage rose from 127 to 128 with zero lifecycle violations.","timestamp":1787234848548,"segment":11,"confidence":3.8181818181818183,"asi":{"hypothesis":"A same-model executor with a different reasoning level is a valid handoff and must still arm, ensuring the same-model no-op guard does not over-restrict useful reasoning-level transitions.","result":"The distinct same-model reasoning-difference integration scenario passed; explicit composition checks and typecheck passed. Coverage rose to 128 scenarios with every lifecycle dimension at zero.","consistency_check":"The exact test title and scorer pattern each occur once; the new scenario ID is unique. The same-model no-op, configuration guard, child-target, and provider handoff cases remain distinct.","scope_check":"Only one existing same-model positive integration flow was added to the frozen matrix; no production resolver policy, assertions, labels, or scorer semantics changed."}}
{"run":162,"commit":"a4278e9","metric":129,"metrics":{"lifecycle_violations":0,"duplicate_admission":0,"duplicate_continuation":0,"stale_recovery":0,"unfinished_run":0,"failed_scenarios":0},"status":"keep","description":"Add wizard same-model no-op coverage; composition coverage rose from 128 to 129 with zero lifecycle violations.","timestamp":1787235219613,"segment":11,"confidence":3.6666666666666665,"asi":{"hypothesis":"The configuration wizard should reject the running model at its own reasoning level before saving, preventing a no-op executor pairing and later duplicate admission or a misleading handoff.","result":"The distinct wizard same-model safety integration scenario passed; explicit composition checks and typecheck passed. Coverage rose to 129 scenarios with every lifecycle dimension at zero.","consistency_check":"The exact test title and scorer pattern each occur once; the new scenario ID is unique. Existing arm-time no-op, same-model reasoning-difference, clamping, and fallback configuration cases remain distinct.","scope_check":"Only one existing wizard safety integration flow was added to the frozen matrix; no production resolver policy, assertions, labels, or scorer semantics changed."}}
{"run":163,"commit":"e7aef7c","metric":130,"metrics":{"lifecycle_violations":0,"duplicate_admission":0,"duplicate_continuation":0,"stale_recovery":0,"unfinished_run":0,"failed_scenarios":0},"status":"keep","description":"Add wizard clamped same-model coverage; composition coverage rose from 129 to 130 with zero lifecycle violations.","timestamp":1787235556261,"segment":11,"confidence":3.8333333333333335,"asi":{"hypothesis":"The configuration wizard should reject a same-model executor when its requested reasoning effort normalizes to the planner’s current level, preventing an invalid no-op pairing after clamping.","result":"The distinct clamped same-model wizard integration scenario passed; explicit composition checks and typecheck passed. Coverage rose to 130 scenarios with every lifecycle dimension at zero.","consistency_check":"The exact test title and scorer pattern each occur once; the new scenario ID is unique. Existing exact same-model, arm-time no-op, reasoning-difference, and child-target cases remain distinct.","scope_check":"Only one existing wizard normalization-safety integration flow was added to the frozen matrix; no production resolver policy, assertions, labels, or scorer semantics changed."}}
{"run":164,"commit":"d713478","metric":131,"metrics":{"lifecycle_violations":0,"duplicate_admission":0,"duplicate_continuation":0,"stale_recovery":0,"unfinished_run":0,"failed_scenarios":0},"status":"keep","description":"Add analytics reset-confirmation coverage; composition coverage rose from 130 to 131 with zero lifecycle violations.","timestamp":1787236022415,"segment":11,"confidence":4,"asi":{"hypothesis":"An active run must remain untouched when analytics reset confirmation is declined, and only be excluded after explicit confirmation, preventing premature lifecycle loss.","result":"The distinct analytics-reset integration scenario passed; explicit composition checks and typecheck passed. Coverage rose to 131 scenarios with every lifecycle dimension at zero.","consistency_check":"The exact test title and scorer pattern each occur once; the new scenario ID is unique. Existing analytics-disabled, cleanup-retry, receipt-finality, and compaction-failure cases remain distinct.","scope_check":"Only one existing analytics-reset confirmation flow was added to the frozen matrix; no production analytics policy, assertions, labels, or scorer semantics changed."}}
