{"run":112,"commit":"86f300c","metric":81,"metrics":{"lifecycle_violations":0,"duplicate_admission":0,"duplicate_continuation":0,"stale_recovery":0,"unfinished_run":0,"failed_scenarios":0},"status":"keep","description":"Add duplicate terminal subagent delivery coverage; coverage rose from 80 to 81 with zero lifecycle violations.","timestamp":1787219435365,"segment":10,"confidence":3.945945945945946,"asi":{"hypothesis":"Repeated delivery of one terminal subagent result must be counted once, preventing duplicate task-tree evidence and lifecycle observations.","result":"The tagged matrix now executes eighty-one real scenarios; all passed with zero lifecycle violations, zero duplicate admissions, and zero duplicate continuations. The focused composition checks, typecheck, and complete extension.test.ts module (152 tests) all passed.","consistency_check":"The exact test title appears once in extension.test.ts and once as its scorer pattern; the new scenario ID appears once. Existing direct-tool, source-ownership, and recovery-limit entries remain distinct.","scope_check":"The diff adds one existing regression to the frozen matrix only; no production behavior, test assertions, labels, or scorer logic changed."}}
{"run":113,"commit":"3129e36","metric":82,"metrics":{"lifecycle_violations":0,"duplicate_admission":0,"duplicate_continuation":0,"stale_recovery":0,"unfinished_run":0,"failed_scenarios":0},"status":"keep","description":"Add analytics failure-isolation coverage; coverage rose from 81 to 82 with zero lifecycle violations.","timestamp":1787219609508,"segment":10,"confidence":3.8947368421052633,"asi":{"hypothesis":"A failed analytics-generation lookup must not block a subagent execution or leave the parent lifecycle unfinished.","result":"The tagged matrix now executes eighty-two real scenarios; all passed with zero lifecycle violations, zero duplicate admissions, and zero duplicate continuations. The focused composition checks, typecheck, and complete extension.test.ts module (152 tests) all passed.","consistency_check":"The exact test title appears once in extension.test.ts and once as its scorer pattern; the new scenario ID appears once. The preceding duplicate-result boundary remains distinct.","scope_check":"The diff adds one existing regression to the frozen matrix only; no production behavior, test assertions, labels, or scorer logic changed."}}
{"run":114,"commit":"23e269d","metric":83,"metrics":{"lifecycle_violations":0,"duplicate_admission":0,"duplicate_continuation":0,"stale_recovery":0,"unfinished_run":0,"failed_scenarios":0},"status":"keep","description":"Add unrelated analytics-input isolation coverage; coverage rose from 82 to 83 with zero lifecycle violations.","timestamp":1787219785627,"segment":10,"confidence":3.9473684210526314,"asi":{"hypothesis":"Unrelated tool results, even with misleading run IDs or costs, must not enter task-tree analytics or contaminate lifecycle evidence.","result":"The tagged matrix now executes eighty-three real scenarios; all passed with zero lifecycle violations, zero duplicate admissions, and zero duplicate continuations. The focused composition checks, typecheck, and complete extension.test.ts module (152 tests) all passed.","consistency_check":"The exact test title appears once in extension.test.ts and once as its scorer pattern; the new scenario ID appears once. Existing analytics-failure and duplicate-delivery boundaries remain distinct.","scope_check":"The diff adds one existing regression to the frozen matrix only; no production behavior, test assertions, labels, or scorer logic changed."}}
{"run":115,"commit":"9c5736e","metric":84,"metrics":{"lifecycle_violations":0,"duplicate_admission":0,"duplicate_continuation":0,"stale_recovery":0,"unfinished_run":0,"failed_scenarios":0},"status":"keep","description":"Add serial delegation task-tree aggregation coverage; coverage rose from 83 to 84 with zero lifecycle violations.","timestamp":1787219961159,"segment":10,"confidence":4,"asi":{"hypothesis":"Evidence from sequential subagent invocations remains in one task tree with complete child accounting and cost coverage, rather than fragmenting or losing evidence.","result":"The tagged matrix now executes eighty-four real scenarios; all passed with zero lifecycle violations, zero duplicate admissions, and zero duplicate continuations. The focused composition checks, typecheck, and complete extension.test.ts module (152 tests) all passed.","consistency_check":"The exact test title appears once in extension.test.ts and once as its scorer pattern; the new scenario ID appears once. Existing duplicate-delivery, analytics-isolation, and source-ownership boundaries remain distinct.","scope_check":"The diff adds one existing regression to the frozen matrix only; no production behavior, test assertions, labels, or scorer logic changed."}}
{"run":116,"commit":"2b8467e","metric":85,"metrics":{"lifecycle_violations":0,"duplicate_admission":0,"duplicate_continuation":0,"stale_recovery":0,"unfinished_run":0,"failed_scenarios":0},"status":"keep","description":"Add explicit delegation-status coverage; coverage rose from 84 to 85 with zero lifecycle violations.","timestamp":1787220148494,"segment":10,"confidence":3.948717948717949,"asi":{"hypothesis":"Delegation progress must be exposed through explicit status as running and completed without leaking child names into the compact footer.","result":"The tagged matrix now executes eighty-five real scenarios; all passed with zero lifecycle violations, zero duplicate admissions, and zero duplicate continuations. The focused composition checks, typecheck, and complete extension.test.ts module (152 tests) all passed.","consistency_check":"The exact test title appears once in extension.test.ts and once as its scorer pattern; the new scenario ID appears once. Existing serial-tree, duplicate-delivery, and analytics-isolation boundaries remain distinct.","scope_check":"The diff adds one existing regression to the frozen matrix only; no production behavior, test assertions, labels, or scorer logic changed."}}
{"run":117,"commit":"f68e447","metric":86,"metrics":{"lifecycle_violations":0,"duplicate_admission":0,"duplicate_continuation":0,"stale_recovery":0,"unfinished_run":0,"failed_scenarios":0},"status":"keep","description":"Add planning-only receipt integrity coverage; coverage rose from 85 to 86 with zero lifecycle violations.","timestamp":1787220339357,"segment":10,"confidence":3.9,"asi":{"hypothesis":"A planning-only run must report success without inventing a model comparison or falsely claiming a model transition.","result":"The tagged matrix now executes eighty-six real scenarios; all passed with zero lifecycle violations, zero duplicate admissions, and zero duplicate continuations. The focused composition checks, typecheck, and complete extension.test.ts module (152 tests) all passed.","consistency_check":"The exact test title appears once in extension.test.ts and once as its scorer pattern; the new scenario ID appears once. Existing shutdown, source-ownership, and delegation-status boundaries remain distinct.","scope_check":"The diff adds one existing regression to the frozen matrix only; no production behavior, test assertions, labels, or scorer logic changed."}}
{"run":118,"commit":"e6e503c","metric":87,"metrics":{"lifecycle_violations":0,"duplicate_admission":0,"duplicate_continuation":0,"stale_recovery":0,"unfinished_run":0,"failed_scenarios":0},"status":"keep","description":"Add cancellation-settlement race coverage; coverage rose from 86 to 87 with zero lifecycle violations.","timestamp":1787220546136,"segment":10,"confidence":3.95,"asi":{"hypothesis":"A settlement arriving while cancellation finalization is blocked must not revive the run or add a continuation after cancellation wins.","result":"The tagged matrix now executes eighty-seven real scenarios; all passed with zero lifecycle violations, zero duplicate continuations, and zero unfinished runs. The focused composition checks, typecheck, and complete extension.test.ts module (152 tests) all passed.","consistency_check":"The exact test title appears once in extension.test.ts and once as its scorer pattern; the new scenario ID appears once. The existing stale-settlement replacement case remains distinct.","scope_check":"The diff adds one existing regression to the frozen matrix only; no production behavior, test assertions, labels, or scorer logic changed."}}
{"run":119,"commit":"9c51fd1","metric":88,"metrics":{"lifecycle_violations":0,"duplicate_admission":0,"duplicate_continuation":0,"stale_recovery":0,"unfinished_run":0,"failed_scenarios":0},"status":"keep","description":"Add post-receipt finality coverage; coverage rose from 87 to 88 with zero lifecycle violations.","timestamp":1787220721547,"segment":10,"confidence":4,"asi":{"hypothesis":"Late usage after receipt finalization must not resurrect the journal or append spend outside the immutable written receipt.","result":"The tagged matrix now executes eighty-eight real scenarios; all passed with zero lifecycle violations, zero unfinished runs, and zero duplicate continuations. The focused composition checks, typecheck, and complete extension.test.ts module (152 tests) all passed.","consistency_check":"The exact test title appears once in extension.test.ts and once as its scorer pattern; the new scenario ID appears once. Existing planning-only receipt and cancellation-race boundaries remain distinct.","scope_check":"The diff adds one existing regression to the frozen matrix only; no production behavior, test assertions, labels, or scorer logic changed."}}
{"run":120,"commit":"e6e4a7f","metric":89,"metrics":{"lifecycle_violations":0,"duplicate_admission":0,"duplicate_continuation":0,"stale_recovery":0,"unfinished_run":0,"failed_scenarios":0},"status":"keep","description":"Add analytics-generation reset isolation coverage; coverage rose from 88 to 89 with zero lifecycle violations.","timestamp":1787220888907,"segment":10,"confidence":3.951219512195122,"asi":{"hypothesis":"A child result from before an analytics reset must be excluded after the reset, preventing stale-generation evidence from entering the new task tree.","result":"The tagged matrix now executes eighty-nine real scenarios; all passed with zero lifecycle violations, zero stale-recovery failures, and zero duplicate admissions. The focused composition checks, typecheck, and complete extension.test.ts module (152 tests) all passed.","consistency_check":"The exact test title appears once in extension.test.ts and once as its scorer pattern; the new scenario ID appears once. Existing post-receipt finality and analytics-isolation boundaries remain distinct.","scope_check":"The diff adds one existing regression to the frozen matrix only; no production behavior, test assertions, labels, or scorer logic changed."}}
{"run":121,"commit":"19befa7","metric":90,"metrics":{"lifecycle_violations":0,"duplicate_admission":0,"duplicate_continuation":0,"stale_recovery":0,"unfinished_run":0,"failed_scenarios":0},"status":"keep","description":"Add completed-finalization recovery coverage; coverage rose from 89 to 90 with zero lifecycle violations.","timestamp":1787221068298,"segment":10,"confidence":3.9047619047619047,"asi":{"hypothesis":"When completed analytics finalization fails, the run must remain recoverable on reload rather than being marked completed or lost.","result":"The tagged matrix now executes ninety real scenarios; all passed with zero lifecycle violations, zero stale-recovery failures, and zero unfinished runs. The focused composition checks, typecheck, and complete extension.test.ts module (152 tests) all passed.","consistency_check":"The exact test title appears once in extension.test.ts and once as its scorer pattern; the new scenario ID appears once. Existing analytics-generation reset, cancellation-race, and post-receipt finality boundaries remain distinct.","scope_check":"The diff adds one existing regression to the frozen matrix only; no production behavior, test assertions, labels, or scorer logic changed."}}
{"run":122,"commit":"df4adb2","metric":91,"metrics":{"lifecycle_violations":0,"duplicate_admission":0,"duplicate_continuation":0,"stale_recovery":0,"unfinished_run":0,"failed_scenarios":0},"status":"keep","description":"Add executor attribution coverage; coverage rose from 90 to 91 with zero lifecycle violations.","timestamp":1787221258776,"segment":10,"confidence":3.9523809523809526,"asi":{"hypothesis":"After executor takeover, later planner messages must count as post-switch spend rather than planning spend, preserving receipt attribution.","result":"The tagged matrix now executes ninety-one real scenarios; all passed with zero lifecycle violations, zero duplicate admissions, and zero duplicate continuations. The focused composition checks, typecheck, and complete extension.test.ts module (152 tests) all passed.","consistency_check":"The redundant shutdown-finalization candidate was rejected because its exact test was already scored; the new executor-attribution title appears once in extension.test.ts and once as its scorer pattern, with one scenario ID.","scope_check":"The diff adds one distinct existing regression to the frozen matrix only; no production behavior, test assertions, labels, or scorer logic changed."}}
{"run":123,"commit":"91eb69a","metric":92,"metrics":{"lifecycle_violations":0,"duplicate_admission":0,"duplicate_continuation":0,"stale_recovery":0,"unfinished_run":0,"failed_scenarios":0},"status":"keep","description":"Add cancelled executor-compaction race coverage; coverage rose from 91 to 92 with zero lifecycle violations.","timestamp":1787221447005,"segment":10,"confidence":4,"asi":{"hypothesis":"Once cancellation wins, a pending executor compaction completion must not inject a retry or restart the run.","result":"The tagged matrix now executes ninety-two real scenarios; all passed with zero lifecycle violations, zero duplicate continuations, and zero unfinished runs. The focused composition checks, typecheck, and complete extension.test.ts module (152 tests) all passed.","consistency_check":"The exact test title appears once in extension.test.ts and once as its scorer pattern; the new scenario ID appears once. Existing manual, overflow, and threshold compaction scenarios remain distinct.","scope_check":"The diff adds one distinct existing regression to the frozen matrix only; no production behavior, test assertions, labels, or scorer logic changed."}}
{"run":124,"commit":"8a7b7e5","metric":93,"metrics":{"lifecycle_violations":0,"duplicate_admission":0,"duplicate_continuation":0,"stale_recovery":0,"unfinished_run":0,"failed_scenarios":0},"status":"keep","description":"Add bounded oversized-compaction retry coverage; coverage rose from 92 to 93 with zero lifecycle violations.","timestamp":1787221636578,"segment":10,"confidence":3.953488372093023,"asi":{"hypothesis":"An executor that remains oversized after one compaction must fail once without looping or injecting duplicate continuation.","result":"The tagged matrix now executes ninety-three real scenarios; all passed with zero lifecycle violations, zero duplicate continuations, and zero unfinished runs. The focused composition checks, typecheck, and complete extension.test.ts module (152 tests) all passed.","consistency_check":"Both existing compaction-error candidates were rejected as already scored; the exact oversized-retry title appears once in extension.test.ts and once as its scorer pattern, with one scenario ID.","scope_check":"The diff adds one distinct existing regression to the frozen matrix only; no production behavior, test assertions, labels, or scorer logic changed."}}
{"run":125,"commit":"d62b809","metric":94,"metrics":{"lifecycle_violations":0,"duplicate_admission":0,"duplicate_continuation":0,"stale_recovery":0,"unfinished_run":0,"failed_scenarios":0},"status":"keep","description":"Add initial-handoff compaction continuity coverage; coverage rose from 93 to 94 with zero lifecycle violations.","timestamp":1787221823353,"segment":10,"confidence":3.909090909090909,"asi":{"hypothesis":"The initial executor handoff remains active while compaction settles the agent and emits exactly one retry trigger instead of demoting or duplicating the run.","result":"The tagged matrix now executes ninety-four real scenarios; all passed with zero lifecycle violations, zero duplicate continuations, and zero unfinished runs. The focused composition checks, typecheck, and complete extension.test.ts module (152 tests) all passed.","consistency_check":"The exact test title appears once in extension.test.ts and once as its scorer pattern; the new scenario ID appears once. Existing manual, overflow, threshold, cancellation, and oversized-retry compaction boundaries remain distinct.","scope_check":"The diff adds one distinct existing regression to the frozen matrix only; no production behavior, test assertions, labels, or scorer logic changed."}}
{"run":126,"commit":"55df7e1","metric":95,"metrics":{"lifecycle_violations":0,"duplicate_admission":0,"duplicate_continuation":0,"stale_recovery":0,"unfinished_run":0,"failed_scenarios":0},"status":"keep","description":"Add threshold-compaction resume coverage; coverage rose from 94 to 95 with zero lifecycle violations.","timestamp":1787222012349,"segment":10,"confidence":3.9545454545454546,"asi":{"hypothesis":"Unfinished executor work receives exactly one continuation after host-threshold compaction, while duplicate compaction notifications are ignored.","result":"The tagged matrix now executes ninety-five real scenarios; all passed with zero lifecycle violations, zero duplicate continuations, and zero unfinished runs. The focused composition checks, typecheck, and complete extension.test.ts module (152 tests) all passed.","consistency_check":"The exact test title appears once in extension.test.ts and once as its scorer pattern; the new scenario ID appears once. Existing initial-handoff, cancelled-compaction, and bounded-retry cases remain distinct.","scope_check":"The diff adds one distinct existing regression to the frozen matrix only; no production behavior, test assertions, labels, or scorer logic changed."}}
{"run":127,"commit":"f7d46a6","metric":96,"metrics":{"lifecycle_violations":0,"duplicate_admission":0,"duplicate_continuation":0,"stale_recovery":0,"unfinished_run":0,"failed_scenarios":0},"status":"keep","description":"Add completed-stop compaction coverage; coverage rose from 95 to 96 with zero lifecycle violations.","timestamp":1787222204458,"segment":10,"confidence":4,"asi":{"hypothesis":"A completed executor stop at threshold must not receive a retry after compaction, preventing duplicate continuation.","result":"The tagged matrix now executes ninety-six real scenarios; all passed with zero lifecycle violations, zero duplicate continuations, and zero unfinished runs. The focused composition checks, typecheck, and complete extension.test.ts module (152 tests) all passed.","consistency_check":"The exact test title appears once in extension.test.ts and once as its scorer pattern; the new scenario ID appears once. Existing threshold-resume, initial-handoff, and bounded-retry compaction cases remain distinct.","scope_check":"The diff adds one distinct existing regression to the frozen matrix only; no production behavior, test assertions, labels, or scorer logic changed."}}
{"run":128,"commit":"68147df","metric":97,"metrics":{"lifecycle_violations":0,"duplicate_admission":0,"duplicate_continuation":0,"stale_recovery":0,"unfinished_run":0,"failed_scenarios":0},"status":"keep","description":"Add executor preflight pressure coverage; coverage rose from 96 to 97 with zero lifecycle violations.","timestamp":1787222391236,"segment":10,"confidence":3.9555555555555557,"asi":{"hypothesis":"An oversized executor preflight triggers one compaction and one retry while preserving the continuation contract, rather than failing early or duplicating work.","result":"The tagged matrix now executes ninety-seven real scenarios; all passed with zero lifecycle violations, zero duplicate continuations, and zero unfinished runs. The focused composition checks, typecheck, and complete extension.test.ts module (152 tests) all passed.","consistency_check":"The exact test title appears once in extension.test.ts and once as its scorer pattern; the new scenario ID appears once. Existing threshold, completed-stop, initial-handoff, and bounded-retry cases remain distinct.","scope_check":"The diff adds one distinct existing regression to the frozen matrix only; no production behavior, test assertions, labels, or scorer logic changed."}}
{"run":129,"commit":"ab55849","metric":98,"metrics":{"lifecycle_violations":0,"duplicate_admission":0,"duplicate_continuation":0,"stale_recovery":0,"unfinished_run":0,"failed_scenarios":0},"status":"keep","description":"Add compaction-disabled fail-closed coverage; coverage rose from 97 to 98 with zero lifecycle violations.","timestamp":1787222591008,"segment":10,"confidence":3.9130434782608696,"asi":{"hypothesis":"When Pi automatic compaction is disabled, an oversized executor route must fail closed rather than running without context protection or leaving an unfinished continuation.","result":"The tagged matrix now executes ninety-eight real scenarios; all passed with zero lifecycle violations, zero unfinished runs, and zero duplicate continuations. The focused composition checks, typecheck, and complete extension.test.ts module (152 tests) all passed.","consistency_check":"The exact test title appears once in extension.test.ts and once as its scorer pattern; the new scenario ID appears once. Existing preflight pressure and compaction retry boundaries remain distinct.","scope_check":"The diff adds one distinct existing regression to the frozen matrix only; no production behavior, test assertions, labels, or scorer logic changed."}}
