{"run":165,"commit":"d93910b","metric":132,"metrics":{"lifecycle_violations":0,"duplicate_admission":0,"duplicate_continuation":0,"stale_recovery":0,"unfinished_run":0,"failed_scenarios":0},"status":"keep","description":"Add child target fail-closed coverage; composition coverage rose from 131 to 132 with zero lifecycle violations.","timestamp":1787236537507,"segment":11,"confidence":3.8461538461538463,"asi":{"hypothesis":"An opted-in child with an executor equal to its planner or unavailable must remain unarmed and report the specific reason, preventing inherited invalid routing and unfinished child lifecycles.","result":"The distinct child target fail-closed integration scenario passed; explicit composition checks and typecheck passed. Coverage rose to 132 scenarios with every lifecycle dimension at zero.","consistency_check":"The exact test title and scorer pattern each occur once; the new scenario ID is unique. Existing child executor-unavailable, parent-target isolation, clamped-target, and stock-Pi child-process cases remain distinct.","scope_check":"Only one existing child eligibility integration flow was added to the frozen matrix; no production child policy, assertions, labels, or scorer semantics changed."}}
{"run":166,"commit":"58f30e2","metric":133,"metrics":{"lifecycle_violations":0,"duplicate_admission":0,"duplicate_continuation":0,"stale_recovery":0,"unfinished_run":0,"failed_scenarios":0},"status":"keep","description":"Add executor reasoning-default coverage; composition coverage rose from 132 to 133 with zero lifecycle violations.","timestamp":1787237052082,"segment":11,"confidence":3.7142857142857144,"asi":{"hypothesis":"Selecting a new executor should default its reasoning to low, preventing accidental cost or latency escalation while preserving explicit user choices and configuration-only behavior.","result":"The distinct executor reasoning-default integration scenario passed; explicit composition checks and typecheck passed. Coverage rose to 133 scenarios with every lifecycle dimension at zero.","consistency_check":"The exact test title and scorer pattern each occur once; the new scenario ID is unique. Existing wizard fallback, same-model validation, executor reserve, and configuration-no-start cases remain distinct.","scope_check":"Only one existing executor-selection integration flow was added to the frozen matrix; no production model-picker policy, assertions, labels, or scorer semantics changed."}}
{"run":167,"commit":"a1ca151","metric":134,"metrics":{"lifecycle_violations":0,"duplicate_admission":0,"duplicate_continuation":0,"stale_recovery":0,"unfinished_run":0,"failed_scenarios":0},"status":"keep","description":"Add clamped child-target diagnostic coverage; composition coverage rose from 133 to 134 with zero lifecycle violations.","timestamp":1787237448157,"segment":11,"confidence":3.857142857142857,"asi":{"hypothesis":"A same-model child target whose requested effort clamps to the planner level should remain unarmed and report equal-target, preserving fail-closed child eligibility after normalization.","result":"The distinct clamped child-target integration scenario passed; explicit composition checks and typecheck passed. Coverage rose to 134 scenarios with every lifecycle dimension at zero.","consistency_check":"The exact test title and scorer pattern each occur once; the new scenario ID is unique. Existing exact equal/unavailable child targets, wizard clamping, parent-target isolation, and lower-effort child handoff cases remain distinct.","scope_check":"Only one existing child normalization-diagnostic integration flow was added to the frozen matrix; no production child resolver policy, assertions, labels, or scorer semantics changed."}}
{"run":168,"commit":"9657ae8","metric":135,"metrics":{"lifecycle_violations":0,"duplicate_admission":0,"duplicate_continuation":0,"stale_recovery":0,"unfinished_run":0,"failed_scenarios":0},"status":"keep","description":"Add child-policy command coverage; composition coverage rose from 134 to 135 with zero lifecycle violations.","timestamp":1787237819536,"segment":11,"confidence":4,"asi":{"hypothesis":"Plain-language child on, off, and custom-target commands should persist only the requested child ownership policy, without arming a run or rewriting unrelated child configuration.","result":"The distinct child-policy command integration scenario passed; explicit composition checks and typecheck passed. Coverage rose to 135 scenarios with every lifecycle dimension at zero.","consistency_check":"The exact test title and scorer pattern each occur once; the new scenario ID is unique. Existing child runtime eligibility, target isolation, tool/todo, and wizard configuration cases remain distinct.","scope_check":"Only one existing child-policy command integration flow was added to the frozen matrix; no production command behavior, assertions, labels, or scorer semantics changed."}}
{"run":169,"commit":"2a8c78b","metric":136,"metrics":{"lifecycle_violations":0,"duplicate_admission":0,"duplicate_continuation":0,"stale_recovery":0,"unfinished_run":0,"failed_scenarios":0},"status":"keep","description":"Add child-policy invalid-command coverage; composition coverage rose from 135 to 136 with zero lifecycle violations.","timestamp":1787238208607,"segment":11,"confidence":3.8666666666666667,"asi":{"hypothesis":"Malformed child target commands should fail closed and leave the saved child policy byte-for-byte unchanged, preventing invalid configuration from changing future ownership.","result":"The distinct invalid child-command integration scenario passed; explicit composition checks and typecheck passed. Coverage rose to 136 scenarios with every lifecycle dimension at zero.","consistency_check":"The exact test title and scorer pattern each occur once; the new scenario ID is unique. Existing valid child-policy commands, child target resolution, and wizard configuration cases remain distinct.","scope_check":"Only one existing invalid child-policy command flow was added to the frozen matrix; no production command parser, assertions, labels, or scorer semantics changed."}}
{"run":170,"commit":"d41b36f","metric":137,"metrics":{"lifecycle_violations":0,"duplicate_admission":0,"duplicate_continuation":0,"stale_recovery":0,"unfinished_run":0,"failed_scenarios":0},"status":"keep","description":"Add TUI configuration-cancel coverage; composition coverage rose from 136 to 137 with zero lifecycle violations.","timestamp":1787238664210,"segment":11,"confidence":3.75,"asi":{"hypothesis":"Exiting the TUI configure flow without changes should preserve the saved configuration and avoid arming or mutating runtime state.","result":"The distinct TUI configuration-cancel integration scenario passed; explicit composition checks and typecheck passed. Coverage rose to 137 scenarios with every lifecycle dimension at zero.","consistency_check":"The exact test title and scorer pattern each occur once; the new scenario ID is unique. Existing noninteractive configure, wizard save, child-command, and configuration-no-start cases remain distinct.","scope_check":"Only one existing TUI cancellation integration flow was added to the frozen matrix; no production UI behavior, assertions, labels, or scorer semantics changed."}}
{"run":171,"commit":"bee5290","metric":138,"metrics":{"lifecycle_violations":0,"duplicate_admission":0,"duplicate_continuation":0,"stale_recovery":0,"unfinished_run":0,"failed_scenarios":0},"status":"keep","description":"Add noninteractive configure fail-closed coverage; composition coverage rose from 137 to 138 with zero lifecycle violations.","timestamp":1787239067499,"segment":11,"confidence":3.875,"asi":{"hypothesis":"When no interactive UI is available, configure should explain the host requirement and leave saved configuration and Prewalk lifecycle state untouched.","result":"The distinct noninteractive configure integration scenario passed; explicit composition checks and typecheck passed. Coverage rose to 138 scenarios with every lifecycle dimension at zero.","consistency_check":"The exact test title and scorer pattern each occur once; the new scenario ID is unique. Existing TUI cancellation, wizard save, child command, and configuration-no-start cases remain distinct.","scope_check":"Only one existing noninteractive-configure integration flow was added to the frozen matrix; no production UI policy, assertions, labels, or scorer semantics changed."}}
{"run":172,"commit":"30081bb","metric":139,"metrics":{"lifecycle_violations":0,"duplicate_admission":0,"duplicate_continuation":0,"stale_recovery":0,"unfinished_run":0,"failed_scenarios":0},"status":"keep","description":"Add export existing-destination safety coverage; composition coverage rose from 138 to 139 with zero lifecycle violations.","timestamp":1787239452112,"segment":11,"confidence":4,"asi":{"hypothesis":"Analytics export should refuse an existing destination without changing its bytes, preventing destructive data loss while leaving the Prewalk lifecycle untouched.","result":"The distinct export safety integration scenario passed; explicit composition checks and typecheck passed. Coverage rose to 139 scenarios with every lifecycle dimension at zero.","consistency_check":"The exact test title and scorer pattern each occur once; the new scenario ID is unique. Existing analytics reset, receipt, cleanup, and noninteractive command cases remain distinct.","scope_check":"Only one existing export-destination safety flow was added to the frozen matrix; no production export policy, assertions, labels, or scorer semantics changed."}}
{"run":173,"commit":"1e16eb1","metric":140,"metrics":{"lifecycle_violations":0,"duplicate_admission":0,"duplicate_continuation":0,"stale_recovery":0,"unfinished_run":0,"failed_scenarios":0},"status":"keep","description":"Add TUI analytics-dashboard coverage; composition coverage rose from 139 to 140 with zero lifecycle violations.","timestamp":1787239874496,"segment":11,"confidence":3.8823529411764706,"asi":{"hypothesis":"A TUI stats request should invoke the interactive analytics dashboard exactly once without mutating routing, saved configuration, or active lifecycle state.","result":"The distinct TUI dashboard integration scenario passed; explicit composition checks and typecheck passed. Coverage rose to 140 scenarios with every lifecycle dimension at zero.","consistency_check":"The exact test title and scorer pattern each occur once; the new scenario ID is unique. Existing analytics-disabled, export, stats, receipt, and TUI configuration-cancel cases remain distinct.","scope_check":"Only one existing TUI dashboard integration flow was added to the frozen matrix; no production dashboard behavior, assertions, labels, or scorer semantics changed."}}
{"run":174,"commit":"a0ca7e4","metric":141,"metrics":{"lifecycle_violations":0,"duplicate_admission":0,"duplicate_continuation":0,"stale_recovery":0,"unfinished_run":0,"failed_scenarios":0},"status":"keep","description":"Add cancelled-status model-refresh coverage; composition coverage rose from 140 to 141 with zero lifecycle violations.","timestamp":1787240332322,"segment":11,"confidence":3.7777777777777777,"asi":{"hypothesis":"After cancellation, an explicit Pi model selection should refresh the retained status with the selected model rather than displaying stale route state.","result":"The distinct cancelled-status model-refresh integration scenario passed; explicit composition checks and typecheck passed. Coverage rose to 141 scenarios with every lifecycle dimension at zero.","consistency_check":"The exact test title and scorer pattern each occur once; the new scenario ID is unique. Existing cancellation restoration, explicit-selection cancellation, recovery, and host-retention cases remain distinct.","scope_check":"Only one existing cancelled-status integration flow was added to the frozen matrix; no production status policy, assertions, labels, or scorer semantics changed."}}
{"run":165,"commit":"7d7723b","metric":142,"metrics":{"lifecycle_violations":0,"duplicate_admission":0,"duplicate_continuation":0,"stale_recovery":0,"unfinished_run":0,"failed_scenarios":0},"status":"keep","description":"Add live message reset-ownership boundary coverage; composition coverage rose from 141 to 142 with zero lifecycle violations.","timestamp":1787241534281,"segment":11,"confidence":5.384615384615385,"asi":{"hypothesis":"A live message object should retain exact ownership across session reset while the compatibility-key fallback is cleared, preventing stale key attribution without discarding object identity evidence.","result":"The distinct existing integration scenario passed; composition measurement rose from 141 to 142 scenarios with every lifecycle dimension at zero, and the experiment checks passed.","consistency_check":"The exact test title is represented by one unique scenario ID; this adds frozen coverage only and does not alter the integration test or scorer semantics.","scope_check":"Only .auto composition coverage and experiment logging changed; no production policy, assertions, labels, or tests were modified."}}
{"run":166,"commit":"54964b2","metric":0,"metrics":{"lifecycle_violations":2,"duplicate_admission":0,"duplicate_continuation":0,"stale_recovery":0,"unfinished_run":0,"failed_scenarios":1},"status":"crash","description":"Attempt active-route reasoning override coverage; scorer pattern did not match because the literal plus sign in Shift+Tab was interpreted as regex syntax.","timestamp":1787241975092,"segment":11,"confidence":5.384615384615385,"asi":{"hypothesis":"An active executor route should permit a session-only reasoning change across subsequent routed requests without mutating the persisted executor baseline.","result":"The intended existing integration test was skipped: the scorer's title pattern contains `Shift+Tab`, whose plus sign was interpreted as a regex quantifier, producing one failed scenario and two lifecycle violations.","rollback_reason":"The candidate did not execute its target test and therefore provided no valid coverage improvement; keeping or escaping it after seeing the result would violate the one-cycle instruction and risk benchmark overfitting.","next_action_hint":"Stop here as coordinated. If this boundary is reconsidered in a future authorized experiment, define an independently justified literal-pattern mechanism before running rather than editing the pattern in response to this failure.","scope_check":"Only the single scorer entry was attempted; no production code, tests, labels, or checks changed."}}
{"run":167,"commit":"3d586df","metric":143,"metrics":{"lifecycle_violations":0,"duplicate_admission":0,"duplicate_continuation":0,"stale_recovery":0,"unfinished_run":0,"failed_scenarios":0},"status":"keep","description":"Add pending-unowned FIFO retention coverage; composition coverage rose from 142 to 143 with zero lifecycle violations.","timestamp":1787242357339,"segment":11,"confidence":5.142857142857143,"asi":{"hypothesis":"More than 512 pending explicit-unowned agent markers must retain FIFO ownership so the final marker cannot fall back to a later Prewalk run and spuriously trigger handoff.","result":"The independently selected existing 513-marker integration scenario passed; composition coverage rose from 142 to 143 with every lifecycle dimension at zero, and experiment checks passed.","consistency_check":"The exact test title and scenario ID are each unique. The scenario extends the existing unowned-ordering boundary at the documented 512/513 retention edge without changing test assertions or scorer semantics.","scope_check":"Only one existing host-ordering integration scenario was added to the frozen coverage matrix; no production code, tests, labels, checks, or host-correlation policy changed."}}
{"run":168,"commit":"51887e9","metric":144,"metrics":{"lifecycle_violations":0,"duplicate_admission":0,"duplicate_continuation":0,"stale_recovery":0,"unfinished_run":0,"failed_scenarios":0},"status":"keep","description":"Add model-picker pagination coverage; composition coverage rose from 143 to 144 with zero lifecycle violations.","timestamp":1787242818640,"segment":11,"confidence":5.285714285714286,"asi":{"hypothesis":"A long executor-model list should remain bounded through paginated configuration UI rather than overflowing the terminal or disturbing Prewalk lifecycle state.","result":"The independently selected existing pagination integration scenario passed; composition coverage rose from 143 to 144 with every lifecycle dimension at zero, and experiment checks passed.","consistency_check":"The exact test title and scenario ID are unique. This covers the remaining ordinary extension integration boundary without retrying the failed regex-special candidate or touching benchmark-agent-loop coverage.","scope_check":"Only one existing configuration UI scenario was added to the frozen coverage matrix; no production code, tests, labels, checks, or scorer semantics changed."}}
{"run":169,"commit":"993ed20","metric":145,"metrics":{"lifecycle_violations":0,"duplicate_admission":0,"duplicate_continuation":0,"stale_recovery":0,"unfinished_run":0,"failed_scenarios":0},"status":"keep","description":"Add remote-tool registration precedence coverage; composition coverage rose from 144 to 145 with zero lifecycle violations.","timestamp":1787346655025,"segment":11,"confidence":5.428571428571429,"asi":{"hypothesis":"When a conversion extension registers host duplicates after a remote-tool extension, the first registered remote tool must remain authoritative and the duplicate must never execute, preserving safe extension composition and a settled lifecycle.","result":"The independently selected existing benchmark-agent-loop integration scenario passed as part of the full composition matrix; coverage rose from 144 to 145 with every lifecycle dimension at zero, and automatic experiment checks passed.","consistency_check":"The exact test title occurs once repo-wide in its test and once as the new scorer pattern; the scenario ID is unique. The full scenario matrix ran, not a single-test shortcut.","scope_check":"Only one existing integration scenario was added to .auto/score-composition.mjs. No production code, integration assertions, benchmark corpus, labels, scorer execution semantics, or checks were changed.","verification_plan":"Run the complete benchmark-agent-loop test module, typecheck, and lint after the experiment commit; do not modify verification assets in response to their results."}}
{"run":170,"commit":"d3b9d31","metric":146,"metrics":{"lifecycle_violations":0,"duplicate_admission":0,"duplicate_continuation":0,"stale_recovery":0,"unfinished_run":0,"failed_scenarios":0},"status":"keep","description":"Add planner-side Shift+Tab routing coverage with regex-safe matching; composition coverage rose from 145 to 146 with zero lifecycle violations.","timestamp":1787347040431,"segment":11,"confidence":5.2,"asi":{"hypothesis":"When the planner Sol route is active, Shift+Tab must remain Pi-owned rather than being consumed by the executor overlay, while the thinking-level event refreshes visible status without arming or mutating lifecycle state.","result":"The independently selected existing planner-side integration scenario passed in the full composition matrix; coverage rose from 145 to 146 with every lifecycle dimension at zero, and automatic checks passed.","consistency_check":"The exact test title occurs once repo-wide in its existing test; the scorer entry uses the independently required escaped `\\\\+` form because the scorer passes patterns to Vitest's regex-based `--testNamePattern`. The new scenario ID is unique, and the prior active-Luna Shift+Tab candidate was not retried.","scope_check":"Only one existing integration scenario was added to .auto/score-composition.mjs. No production code, test assertions, benchmark corpus, labels, scorer execution semantics, or checks were changed; the pre-existing .auto/log.jsonl persistence record is separate.","verification_plan":"Run the complete extension integration test module, typecheck, and lint after the experiment commit; do not edit verification assets based on those results.","anti_overfit":"This is a distinct planner-side ownership/status boundary selected from the remaining unscored integration cases, not a scorer or test change designed to alter the result."}}
