{"run":171,"commit":"3bd6ca9","metric":147,"metrics":{"lifecycle_violations":0,"duplicate_admission":0,"duplicate_continuation":0,"stale_recovery":0,"unfinished_run":0,"failed_scenarios":0},"status":"keep","description":"Add active-Luna reasoning override coverage with regex-safe matching; composition coverage rose from 146 to 147 with zero lifecycle violations.","timestamp":1787347379300,"segment":11,"confidence":5,"asi":{"hypothesis":"After the executor Luna route is active, Shift+Tab should update the session-only routed reasoning level while preserving the saved executor baseline and the Prewalk lifecycle.","result":"The selected existing active-Luna integration scenario passed in the full composition matrix; coverage rose from 146 to 147 with every lifecycle dimension at zero, and automatic checks passed.","consistency_check":"The raw test title occurs exactly once repo-wide in test/integration/extension.test.ts; the scorer uses the required escaped `\\\\+` regex form, and the new scorer ID occurs once. This is distinct from the already accepted planner-side Shift+Tab scenario.","prior-failure-handling":"The earlier unescaped active-Luna attempt was logged as a crash because Vitest interpreted `+` as regex syntax. The escaped pattern was selected before this run from the scorer's documented regex behavior; no test, scorer execution logic, or check was changed after observing this result.","scope_check":"Only one existing integration scenario was added to .auto/score-composition.mjs. No production code, test assertions, benchmark corpus, labels, scorer execution semantics, or checks changed.","anti_overfit":"This records a genuine remaining route-ownership boundary and uses a general regex-literal escape, rather than broadening matching or modifying the benchmark to force a pass."}}
{"run":172,"commit":"06729cd","metric":148,"metrics":{"lifecycle_violations":0,"duplicate_admission":0,"duplicate_continuation":0,"stale_recovery":0,"unfinished_run":0,"failed_scenarios":0},"status":"keep","description":"Add exact run-ID and epoch discard coverage; composition coverage rose from 147 to 148 with zero lifecycle violations.","timestamp":1787347808893,"segment":11,"confidence":5.125,"asi":{"hypothesis":"Discarding a failed or cancelled run must remove only its exact run-ID-and-epoch pending agent and compaction markers, preserve newer-epoch and replacement-run evidence, and suppress only the disowned compaction terminal.","result":"The independently selected direct host-correlation safety test passed in the full composition matrix; coverage rose from 147 to 148 with every lifecycle dimension at zero, and automatic checks passed.","consistency_check":"The exact test title occurs once in test/host-event-correlation.test.ts and once in the scorer; the scenario ID is unique. The matrix retained all prior integration and public-runtime coverage.","scope_check":"Only one existing direct characterization test was added to .auto/score-composition.mjs. No host-correlation implementation, production policy, test assertion, benchmark corpus, labels, scorer execution semantics, or checks changed.","selection_reason":"All extension and public Agent-loop integration titles were already in the matrix. This direct exact-discard test is the next high-value stale-event ownership boundary required by the host-event correlation contract, not an arbitrary narrow fixture.","anti_overfit":"The candidate exercises an existing run-ID/epoch safety contract with its original assertions; no result-driven test or scorer changes were made."}}
{"run":173,"commit":"3600463","metric":149,"metrics":{"lifecycle_violations":0,"duplicate_admission":0,"duplicate_continuation":0,"stale_recovery":0,"unfinished_run":0,"failed_scenarios":0},"status":"keep","description":"Add retained-facts preservation coverage after discard; composition coverage rose from 148 to 149 with zero lifecycle violations.","timestamp":1787348117993,"segment":11,"confidence":5.25,"asi":{"hypothesis":"Discarding a failed or cancelled run must remove only its exact pending and compaction markers while leaving retained message, tool, agent-end, settlement, and active ownership facts available to reject stale replacement events.","result":"The independently selected direct host-correlation preservation test passed in the full composition matrix; coverage rose from 148 to 149 with every lifecycle dimension at zero, and automatic checks passed.","consistency_check":"The exact test title occurs once in test/host-event-correlation.test.ts and once in the scorer; the new scenario ID is unique. It complements, rather than duplicates, the preceding exact run-ID/epoch discard scenario.","scope_check":"Only one existing direct characterization test was added to .auto/score-composition.mjs. No host-correlation implementation, production policy, test assertion, benchmark corpus, labels, scorer execution semantics, or checks changed.","selection_reason":"This is the paired safety boundary to exact discard: it proves discard is narrow and cannot over-remove facts needed for stale-event rejection. It was selected over unrelated analytics/configuration unit cases.","anti_overfit":"The original direct test and its assertions were run unchanged; no result-driven changes to the matrix or verification machinery were made."}}
{"run":174,"commit":"2dbb71b","metric":150,"metrics":{"lifecycle_violations":0,"duplicate_admission":0,"duplicate_continuation":0,"stale_recovery":0,"unfinished_run":0,"failed_scenarios":0},"status":"keep","description":"Add stale-settlement replacement ownership coverage; composition coverage rose from 149 to 150 with zero lifecycle violations.","timestamp":1787348515961,"segment":11,"confidence":4.777777777777778,"asi":{"hypothesis":"A stale settlement from run A must not clear the active ownership marker for replacement run B; the next exact settlement must still apply to B.","result":"The independently selected direct host-correlation stale-settlement test passed in the full composition matrix; coverage rose from 149 to 150 with every lifecycle dimension at zero, and automatic checks passed.","consistency_check":"The exact test title occurs once in test/host-event-correlation.test.ts and once in the scorer; the scenario ID is unique. It complements the already accepted exact-discard and retained-facts boundaries and the existing integration stale-settlement case.","scope_check":"Only one existing direct characterization test was added to .auto/score-composition.mjs. No host-correlation implementation, production policy, test assertion, benchmark corpus, labels, scorer execution semantics, or checks changed.","selection_reason":"This is a direct replacement-run ownership invariant at the heart of stale host-event safety, selected over unrelated analytics/configuration cases.","anti_overfit":"The original test and assertions ran unchanged; no result-driven changes to the candidate, matrix semantics, or verification machinery were made."}}
{"run":185,"commit":"2dbb71b","metric":0,"metrics":{"lifecycle_violations":0,"duplicate_admission":0,"duplicate_continuation":0,"stale_recovery":0,"unfinished_run":0,"failed_scenarios":0},"status":"crash","description":"Attempt run-ID/epoch identity-kind coverage; the composition measurement timed out before producing metrics.","timestamp":1787584644992,"segment":11,"confidence":3.909090909090909,"asi":{"hypothesis":"Host correlation must compare both runId and epoch while distinguishing explicit-unowned evidence from genuinely unknown evidence so stale observations cannot contaminate replacement runs.","result":"The native composition run timed out before returning any METRIC lines, so it produced no valid evidence about the candidate. Required secondary metric fields are recorded as zero placeholders for the crash record, not measured outcomes.","rollback_reason":"A timed-out run cannot establish scenario coverage or safety-counter results; the candidate must not be kept or tuned after the timeout.","next_action_hint":"Remove only the unaccepted `host-correlation-identity-kind-boundary` scorer entry if autoresearch-file preservation retains it, restore the accepted 150-scenario matrix, and verify the unchanged host-correlation suite, typecheck, and lint.","scope_check":"Before the run, only the candidate scorer entry and the prior persisted log record were modified; no production code, test assertion, benchmark corpus, labels, scorer semantics, or checks changed.","anti_overfit":"Do not increase timeout, narrow execution, or edit the test/pattern in response to this timeout within the same experiment cycle."}}
{"run":186,"commit":"22dc260","metric":151,"metrics":{"lifecycle_violations":0,"duplicate_admission":0,"duplicate_continuation":0,"stale_recovery":0,"unfinished_run":0,"failed_scenarios":0},"status":"keep","description":"Add ten-variant decision-kind contract coverage; composition coverage rose from 150 to 151 with zero lifecycle violations.","timestamp":1787585032957,"segment":11,"confidence":4,"asi":{"hypothesis":"Every neutral host observation must preserve the documented decision-kind pairing, including exact, unowned, and unknown outcomes, so factual attribution cannot silently become semantic policy drift.","result":"The independently selected broad direct host-correlation contract test passed in the full composition matrix; coverage rose from 150 to 151 with every lifecycle dimension at zero, and automatic checks passed.","consistency_check":"The exact test title occurs once in test/host-event-correlation.test.ts and once in the scorer; the scenario ID is unique. The prior timed-out run-ID/epoch candidate was not retried or altered.","scope_check":"Only one existing direct characterization test was added to .auto/score-composition.mjs. No host-correlation implementation, production policy, test assertion, benchmark corpus, labels, scorer execution semantics, timeout settings, or checks changed.","selection_reason":"This ten-variant contract is broader and more foundational than another narrow FIFO case: it validates the decision/attribution invariant across agent, message, tool, and compaction observations.","anti_overfit":"The original test and assertions ran unchanged, and the candidate was selected before execution without changing the timeout or benchmark machinery."}}
{"run":187,"commit":"97298aa","metric":152,"metrics":{"lifecycle_violations":0,"duplicate_admission":0,"duplicate_continuation":0,"stale_recovery":0,"unfinished_run":0,"failed_scenarios":0},"status":"keep","description":"Add pending-to-settlement FIFO ownership coverage; composition coverage rose from 151 to 152 with zero lifecycle violations.","timestamp":1787585327171,"segment":11,"confidence":3.9130434782608696,"asi":{"hypothesis":"A pending agent marker must move through stale agent-start, agent-end, and settlement observations in FIFO order before current-run fallback can apply, preventing replacement runs from consuming old ownership.","result":"The independently selected direct host-correlation ordering test passed in the full composition matrix; coverage rose from 151 to 152 with every lifecycle dimension at zero, and automatic checks passed.","consistency_check":"The exact test title occurs once in test/host-event-correlation.test.ts and once in the scorer; the scenario ID is unique. It complements the accepted decision-kind, exact-discard, retained-facts, and stale-settlement boundaries.","scope_check":"Only one existing direct characterization test was added to .auto/score-composition.mjs. No host-correlation implementation, production policy, test assertion, benchmark corpus, labels, scorer execution semantics, or checks changed.","selection_reason":"This is the core FIFO attribution path for pending agent ownership and current fallback, directly exercising the host-event ordering contract rather than an unrelated unit case.","anti_overfit":"The original test and assertions ran unchanged; no result-driven changes to the candidate, timeout, matrix semantics, or verification machinery were made."}}
{"run":188,"commit":"97298aa","metric":0,"metrics":{"lifecycle_violations":0,"duplicate_admission":0,"duplicate_continuation":0,"stale_recovery":0,"unfinished_run":0,"failed_scenarios":0},"status":"crash","description":"Attempt interleaved agent-stream FIFO ownership coverage; the composition experiment was aborted before producing metrics.","timestamp":1787594308159,"segment":11,"confidence":3.9130434782608696,"asi":{"hypothesis":"Interleaved agent streams must retain exact FIFO ownership for their agent-end and settlement evidence so one stream cannot consume or clear another stream's facts.","result":"The native composition experiment was aborted before returning any METRIC lines, so it produced no valid candidate evidence. Required secondary fields are recorded as zero placeholders for the crash record, not measured results.","rollback_reason":"An aborted run cannot establish scenario coverage or safety-counter results; the candidate must not be kept or rerun or tuned in response to the abort.","next_action_hint":"Remove only the unaccepted `host-correlation-interleaved-fifo-boundary` scorer entry if crash preservation retained it, restore the accepted 152-scenario matrix, and verify the unchanged host-correlation suite, typecheck, and lint.","scope_check":"Before execution, only the candidate scorer entry and the pre-existing persisted log record were modified; no production code, test assertions, benchmark corpus, labels, scorer semantics, timeout settings, or checks changed.","anti_overfit":"Do not rerun, increase timeout, isolate the candidate, or edit the test/pattern after this aborted result."}}
