{"run":52,"commit":"bfeaee3","metric":21,"metrics":{"lifecycle_violations":0,"duplicate_admission":0,"duplicate_continuation":0,"stale_recovery":0,"unfinished_run":0,"failed_scenarios":0},"status":"keep","description":"Add automatic-compaction-disabled fail-closed coverage; coverage rose from 20 to 21 with zero lifecycle violations.","timestamp":1787209841998,"segment":10,"confidence":3.7142857142857144,"asi":{"hypothesis":"The existing disabled-automatic-compaction regression test verifies Prewalk refuses planner transport rather than proceeding without a safe pressure transaction.","result":"The tagged matrix now executes twenty-one real scenarios; all passed with zero lifecycle violations and zero unfinished-run failures, while the full composition file and typecheck remained green."}}
{"run":53,"commit":"99ed7a4","metric":22,"metrics":{"lifecycle_violations":0,"duplicate_admission":0,"duplicate_continuation":0,"stale_recovery":0,"unfinished_run":0,"failed_scenarios":0},"status":"keep","description":"Add committed executor-compaction observer-error recovery coverage; coverage rose from 21 to 22 with zero lifecycle violations.","timestamp":1787209940644,"segment":10,"confidence":3.5,"asi":{"hypothesis":"The existing executor compaction observer-error regression test verifies committed progress survives an observer failure without leaving an unfinished route.","result":"The tagged matrix now executes twenty-two real scenarios; all passed with zero lifecycle violations and zero unfinished-run failures, while the full composition file and typecheck remained green."}}
{"run":54,"commit":"41688fb","metric":23,"metrics":{"lifecycle_violations":0,"duplicate_admission":0,"duplicate_continuation":0,"stale_recovery":0,"unfinished_run":0,"failed_scenarios":0},"status":"keep","description":"Add executor compaction error termination coverage; coverage rose from 22 to 23 with zero lifecycle violations.","timestamp":1787210039765,"segment":10,"confidence":3.75,"asi":{"hypothesis":"The existing executor-compaction error regression test verifies one terminal failure rather than retrying or leaving the run unfinished, complementing observer-error recovery.","result":"The tagged matrix now executes twenty-three real scenarios; all passed with zero lifecycle violations and zero unfinished-run failures, while the full composition file and typecheck remained green."}}
{"run":55,"commit":"617e3fa","metric":24,"metrics":{"lifecycle_violations":0,"duplicate_admission":0,"duplicate_continuation":0,"stale_recovery":0,"unfinished_run":0,"failed_scenarios":0},"status":"keep","description":"Add compaction analytics-persistence failure resilience coverage; coverage rose from 23 to 24 with zero lifecycle violations.","timestamp":1787210144985,"segment":10,"confidence":4,"asi":{"hypothesis":"The existing compaction analytics failure regression test verifies observability persistence errors do not reject committed compaction or leave the route unfinished.","result":"The tagged matrix now executes twenty-four real scenarios; all passed with zero lifecycle violations and zero unfinished-run failures, while the full composition file and typecheck remained green."}}
{"run":56,"commit":"d49b989","metric":25,"metrics":{"lifecycle_violations":0,"duplicate_admission":0,"duplicate_continuation":0,"stale_recovery":0,"unfinished_run":0,"failed_scenarios":0},"status":"keep","description":"Add cancellation analytics-failure lease restoration coverage; coverage rose from 24 to 25 with zero lifecycle violations.","timestamp":1787210248052,"segment":10,"confidence":3.7777777777777777,"asi":{"hypothesis":"The existing cancellation analytics finalization regression test verifies provider lease restoration remains safe when observability cleanup fails.","result":"The tagged matrix now executes twenty-five real scenarios; all passed with zero lifecycle violations and zero unfinished-run failures, while the full composition file and typecheck remained green."}}
{"run":57,"commit":"688e3c9","metric":26,"metrics":{"lifecycle_violations":0,"duplicate_admission":0,"duplicate_continuation":0,"stale_recovery":0,"unfinished_run":0,"failed_scenarios":0},"status":"keep","description":"Add shutdown analytics-finalization failure resilience coverage; coverage rose from 25 to 26 with zero lifecycle violations.","timestamp":1787210351455,"segment":10,"confidence":3.6,"asi":{"hypothesis":"The existing shutdown analytics regression test verifies a persistence failure does not create a false session-ended receipt or leave lifecycle cleanup unfinished.","result":"The tagged matrix now executes twenty-six real scenarios; all passed with zero lifecycle violations and zero unfinished-run failures, while the full composition file and typecheck remained green."}}
{"run":58,"commit":"17d0490","metric":27,"metrics":{"lifecycle_violations":0,"duplicate_admission":0,"duplicate_continuation":0,"stale_recovery":0,"unfinished_run":0,"failed_scenarios":0},"status":"keep","description":"Add child-result mutation isolation coverage; coverage rose from 26 to 27 with zero lifecycle violations.","timestamp":1787210467713,"segment":10,"confidence":3.8,"asi":{"hypothesis":"The existing child-subagent mutation regression test verifies a child result cannot satisfy the parent mutation gate or trigger an early handoff.","result":"The tagged matrix now executes twenty-seven real scenarios; all passed with zero lifecycle violations, while the full composition file and typecheck remained green."}}
{"run":59,"commit":"aa43da4","metric":28,"metrics":{"lifecycle_violations":0,"duplicate_admission":0,"duplicate_continuation":0,"stale_recovery":0,"unfinished_run":0,"failed_scenarios":0},"status":"keep","description":"Add opted-in child local-todo handoff gate coverage; coverage rose from 27 to 28 with zero lifecycle violations.","timestamp":1787210580639,"segment":10,"confidence":4,"asi":{"hypothesis":"The existing child local-todo regression test verifies child handoff remains gated and its tool slate is restored, without moving child policy into host correlation.","result":"The tagged matrix now executes twenty-eight real scenarios; all passed with zero lifecycle violations, while the full composition file and typecheck remained green."}}
{"run":60,"commit":"def7007","metric":29,"metrics":{"lifecycle_violations":0,"duplicate_admission":0,"duplicate_continuation":0,"stale_recovery":0,"unfinished_run":0,"failed_scenarios":0},"status":"keep","description":"Add child proven-mutation handoff coverage; coverage rose from 28 to 29 with zero lifecycle violations.","timestamp":1787210687662,"segment":10,"confidence":3.8181818181818183,"asi":{"hypothesis":"The existing child handoff regression test verifies lower-effort same-model routing is gated by proven mutation, complementing child todo and isolation coverage.","result":"The tagged matrix now executes twenty-nine real scenarios; all passed with zero lifecycle violations, while the full composition file and typecheck remained green."}}
{"run":61,"commit":"a87e71d","metric":30,"metrics":{"lifecycle_violations":0,"duplicate_admission":0,"duplicate_continuation":0,"stale_recovery":0,"unfinished_run":0,"failed_scenarios":0},"status":"keep","description":"Add restricted-child local-todo fail-closed coverage; coverage rose from 29 to 30 with zero lifecycle violations.","timestamp":1787210808569,"segment":10,"confidence":3.6666666666666665,"asi":{"hypothesis":"The existing restricted-child regression test verifies a child slate without its local todo remains an open gate rather than proceeding unsafely.","result":"The tagged matrix now executes thirty real scenarios; all passed with zero lifecycle violations, while the full composition file and typecheck remained green."}}
{"run":62,"commit":"17257bd","metric":31,"metrics":{"lifecycle_violations":0,"duplicate_admission":0,"duplicate_continuation":0,"stale_recovery":0,"unfinished_run":0,"failed_scenarios":0},"status":"keep","description":"Add unconfigured-child tool-slate non-interference coverage; coverage rose from 30 to 31 with zero lifecycle violations.","timestamp":1787210924040,"segment":10,"confidence":3.8333333333333335,"asi":{"hypothesis":"The existing unconfigured-child regression test verifies Prewalk leaves unrelated child tool inputs unchanged, complementing child gate coverage.","result":"The tagged matrix now executes thirty-one real scenarios; all passed with zero lifecycle violations, while the full composition file and typecheck remained green."}}
{"run":63,"commit":"d63a8e9","metric":32,"metrics":{"lifecycle_violations":0,"duplicate_admission":0,"duplicate_continuation":0,"stale_recovery":0,"unfinished_run":0,"failed_scenarios":0},"status":"keep","description":"Add foreign-todo ownership isolation coverage; coverage rose from 31 to 32 with zero lifecycle violations.","timestamp":1787211052372,"segment":10,"confidence":4,"asi":{"hypothesis":"The existing foreign-todo regression test verifies Prewalk does not claim or mutate another extension's todo lifecycle, complementing child slate isolation.","result":"The tagged matrix now executes thirty-two real scenarios; all passed with zero lifecycle violations, while the full composition file and typecheck remained green."}}
{"run":64,"commit":"d7e9db0","metric":33,"metrics":{"lifecycle_violations":0,"duplicate_admission":0,"duplicate_continuation":0,"stale_recovery":0,"unfinished_run":0,"failed_scenarios":0},"status":"keep","description":"Add foreign-todo reload restoration coverage; coverage rose from 32 to 33 with zero lifecycle violations.","timestamp":1787211181937,"segment":10,"confidence":3.8461538461538463,"asi":{"hypothesis":"The existing same-session reload regression test verifies foreign todo state is restored without entering Prewalk's lifecycle after rehydration.","result":"The tagged matrix now executes thirty-three real scenarios; all passed with zero lifecycle violations, while the full composition file and typecheck remained green."}}
{"run":65,"commit":"1e3f903","metric":34,"metrics":{"lifecycle_violations":0,"duplicate_admission":0,"duplicate_continuation":0,"stale_recovery":0,"unfinished_run":0,"failed_scenarios":0},"status":"keep","description":"Add completed-run reload non-resurrection coverage; coverage rose from 33 to 34 with zero lifecycle violations.","timestamp":1787211314004,"segment":10,"confidence":3.7142857142857144,"asi":{"hypothesis":"The existing completed-run reload regression test verifies an explicitly completed trajectory cannot re-arm or inject duplicate continuation after reload.","result":"The tagged matrix now executes thirty-four real scenarios; all passed with zero lifecycle violations and zero duplicate-continuation failures, while the full composition file and typecheck remained green."}}
{"run":66,"commit":"6a508ec","metric":35,"metrics":{"lifecycle_violations":0,"duplicate_admission":0,"duplicate_continuation":0,"stale_recovery":0,"unfinished_run":0,"failed_scenarios":0},"status":"keep","description":"Add session-ended reload non-resurrection coverage; coverage rose from 34 to 35 with zero lifecycle violations.","timestamp":1787211463663,"segment":10,"confidence":3.857142857142857,"asi":{"hypothesis":"The existing session-ended reload regression test verifies a successfully terminated trajectory cannot re-arm or inject duplicate continuation after shutdown.","result":"The tagged matrix now executes thirty-five real scenarios; all passed with zero lifecycle violations and zero duplicate-continuation failures, while the full composition file and typecheck remained green."}}
{"run":67,"commit":"defaf61","metric":36,"metrics":{"lifecycle_violations":0,"duplicate_admission":0,"duplicate_continuation":0,"stale_recovery":0,"unfinished_run":0,"failed_scenarios":0},"status":"keep","description":"Add completed executor-route reload restoration coverage; coverage rose from 35 to 36 with zero lifecycle violations.","timestamp":1787211612916,"segment":10,"confidence":4,"asi":{"hypothesis":"The existing completed-Luna reload regression test verifies route restoration does not add an arm or provider request, complementing planner and session-ended reload guards.","result":"The tagged matrix now executes thirty-six real scenarios; all passed with zero lifecycle violations and zero duplicate-continuation failures, while the full composition file and typecheck remained green."}}
{"run":68,"commit":"58e9478","metric":37,"metrics":{"lifecycle_violations":0,"duplicate_admission":0,"duplicate_continuation":0,"stale_recovery":0,"unfinished_run":0,"failed_scenarios":0},"status":"keep","description":"Add planning/failed route reload restoration coverage; coverage rose from 36 to 37 with zero lifecycle violations.","timestamp":1787211762959,"segment":10,"confidence":3.8666666666666667,"asi":{"hypothesis":"The existing planning-and-failed Luna reload regression test verifies restoration does not add an arm or duplicate continuation across non-completed route states.","result":"The tagged matrix now executes thirty-seven real scenarios; all passed with zero lifecycle violations and zero duplicate-continuation failures, while the full composition file and typecheck remained green."}}
{"run":69,"commit":"14f336d","metric":38,"metrics":{"lifecycle_violations":0,"duplicate_admission":0,"duplicate_continuation":0,"stale_recovery":0,"unfinished_run":0,"failed_scenarios":0},"status":"keep","description":"Add cancelled-run restoration safety coverage; coverage rose from 37 to 38 with zero lifecycle violations.","timestamp":1787211918847,"segment":10,"confidence":3.75,"asi":{"hypothesis":"The existing cancelled-run restoration regression test verifies reload avoids model validation and overlay reinstallation, preventing duplicate route setup.","result":"The tagged matrix now executes thirty-eight real scenarios; all passed with zero lifecycle violations and zero duplicate-continuation failures, while the full composition file and typecheck remained green."}}
{"run":70,"commit":"1be1ce1","metric":39,"metrics":{"lifecycle_violations":0,"duplicate_admission":0,"duplicate_continuation":0,"stale_recovery":0,"unfinished_run":0,"failed_scenarios":0},"status":"keep","description":"Add cancelled provider-restore coverage; coverage rose from 38 to 39 with zero lifecycle violations.","timestamp":1787212059739,"segment":10,"confidence":3.875,"asi":{"hypothesis":"The existing live-cancellation regression verifies the conversion provider is restored after cancellation, closing the provider-lease boundary without adding production behavior.","result":"The tagged matrix now executes thirty-nine real scenarios; all passed with zero lifecycle violations, zero unfinished runs, and zero duplicate continuations. The focused composition checks, typecheck, and the complete extension.test.ts module (152 tests) all passed.","consistency_check":"The scenario sentence has one scorer entry and one matching extension.test.ts test title; no duplicate call site required the same change.","scope_check":"The diff adds only one frozen-matrix scenario entry; no production behavior, test assertion, label, or scorer logic changed."}}
{"run":71,"commit":"51e3ee9","metric":40,"metrics":{"lifecycle_violations":0,"duplicate_admission":0,"duplicate_continuation":0,"stale_recovery":0,"unfinished_run":0,"failed_scenarios":0},"status":"keep","description":"Add disposed-run provider-drift coverage; coverage rose from 39 to 40 with zero lifecycle violations.","timestamp":1787212174287,"segment":10,"confidence":4,"asi":{"hypothesis":"A stale provider overlay from a disposed run must fail closed without affecting the replacement run, complementing cancellation provider restoration.","result":"The tagged matrix now executes forty real scenarios; all passed with zero lifecycle violations, zero stale-recovery failures, and zero duplicate continuations. The focused composition checks, typecheck, and complete extension.test.ts module (152 tests) all passed.","consistency_check":"The scenario sentence appears exactly once in the scorer and exactly once as the matching extension.test.ts title.","scope_check":"The diff adds one existing regression to the frozen matrix only; no production behavior, test assertions, labels, or scorer logic changed."}}
{"run":72,"commit":"ea5d60e","metric":41,"metrics":{"lifecycle_violations":0,"duplicate_admission":0,"duplicate_continuation":0,"stale_recovery":0,"unfinished_run":0,"failed_scenarios":0},"status":"keep","description":"Add model-selection source boundary coverage; coverage rose from 40 to 41 with zero lifecycle violations.","timestamp":1787212290329,"segment":10,"confidence":3.8823529411764706,"asi":{"hypothesis":"Restore-sourced model selection must not cancel or duplicate a run, while explicit user selection must cancel it, complementing provider ownership guards.","result":"The tagged matrix now executes forty-one real scenarios; all passed with zero lifecycle violations, zero duplicate continuations, and zero stale-recovery failures. The focused composition checks, typecheck, and complete extension.test.ts module (152 tests) all passed.","consistency_check":"The active source has one matching scorer entry and one matching extension.test.ts title; the unrelated git lost-found copy is not an active call site.","scope_check":"The diff adds one existing regression to the frozen matrix only; no production behavior, test assertions, labels, or scorer logic changed."}}
{"run":73,"commit":"702f58e","metric":42,"metrics":{"lifecycle_violations":0,"duplicate_admission":0,"duplicate_continuation":0,"stale_recovery":0,"unfinished_run":0,"failed_scenarios":0},"status":"keep","description":"Add evaluation model-selection safety coverage; coverage rose from 41 to 42 with zero lifecycle violations.","timestamp":1787212403927,"segment":10,"confidence":3.7777777777777777,"asi":{"hypothesis":"Explicit model selection must disarm an automatic evaluation while restoring automatic readiness and avoiding duplicate admission, including after an active run is selected away.","result":"The tagged matrix now executes forty-two real scenarios; all passed with zero lifecycle violations, zero duplicate admissions, and zero duplicate continuations. The focused composition checks, typecheck, and complete extension.test.ts module (152 tests) all passed.","consistency_check":"The active source has one matching scorer entry and one matching extension.test.ts title; no active duplicate call site requires the same matrix change.","scope_check":"The diff adds one existing regression to the frozen matrix only; no production behavior, test assertions, labels, or scorer logic changed."}}
{"run":74,"commit":"3deb3eb","metric":43,"metrics":{"lifecycle_violations":0,"duplicate_admission":0,"duplicate_continuation":0,"stale_recovery":0,"unfinished_run":0,"failed_scenarios":0},"status":"keep","description":"Add active provider-drift detection coverage; coverage rose from 42 to 43 with zero lifecycle violations.","timestamp":1787212522830,"segment":10,"confidence":3.888888888888889,"asi":{"hypothesis":"An active route must detect provider replacement before its next Agent-loop request rather than using the wrong provider lease, complementing disposed-run drift coverage.","result":"The tagged matrix now executes forty-three real scenarios; all passed with zero lifecycle violations, zero stale-recovery failures, and zero duplicate continuations. The focused composition checks, typecheck, and complete extension.test.ts module (152 tests) all passed.","consistency_check":"The active source has one matching scorer entry and one matching extension.test.ts title; the unrelated git lost-found copy is not an active call site.","scope_check":"The diff adds one existing regression to the frozen matrix only; no production behavior, test assertions, labels, or scorer logic changed."}}
{"run":75,"commit":"255ce75","metric":44,"metrics":{"lifecycle_violations":0,"duplicate_admission":0,"duplicate_continuation":0,"stale_recovery":0,"unfinished_run":0,"failed_scenarios":0},"status":"keep","description":"Add delegated executor-failure route restoration coverage; coverage rose from 43 to 44 with zero lifecycle violations.","timestamp":1787212638009,"segment":10,"confidence":4,"asi":{"hypothesis":"A delegated Luna stream failure must finalize visibly and restore planner routing instead of leaving an unfinished or misrouted provider lease.","result":"The tagged matrix now executes forty-four real scenarios; all passed with zero lifecycle violations, zero unfinished runs, and zero duplicate continuations. The focused composition checks, typecheck, and complete extension.test.ts module (152 tests) all passed.","consistency_check":"The active source has one matching scorer entry and one matching extension.test.ts title; no active duplicate call site requires the same matrix change.","scope_check":"The diff adds one existing regression to the frozen matrix only; no production behavior, test assertions, labels, or scorer logic changed."}}
