{"run":94,"commit":"130932b","metric":63,"metrics":{"lifecycle_violations":0,"duplicate_admission":0,"duplicate_continuation":0,"stale_recovery":0,"unfinished_run":0,"failed_scenarios":0},"status":"keep","description":"Add explicit-empty fallback fail-closed coverage; coverage rose from 62 to 63 with zero lifecycle violations.","timestamp":1787215614240,"segment":10,"confidence":3.9285714285714284,"asi":{"hypothesis":"An explicitly empty executorFallbacks list must disable inference and fail closed, respecting deliberate configuration instead of selecting an unrequested executor.","result":"The tagged matrix now executes sixty-three real scenarios; all passed with zero lifecycle violations, zero unfinished runs, and zero duplicate continuations. The focused composition checks, typecheck, and complete extension.test.ts module (152 tests) all passed.","consistency_check":"The active source has one matching scorer entry and one matching extension.test.ts title; no active duplicate call site requires the same matrix change.","scope_check":"The diff adds one existing regression to the frozen matrix only; no production behavior, test assertions, labels, or scorer logic changed."}}
{"run":95,"commit":"a7be560","metric":64,"metrics":{"lifecycle_violations":0,"duplicate_admission":0,"duplicate_continuation":0,"stale_recovery":0,"unfinished_run":0,"failed_scenarios":0},"status":"keep","description":"Add configuration-without-start coverage; coverage rose from 63 to 64 with zero lifecycle violations.","timestamp":1787215824079,"segment":10,"confidence":4,"asi":{"hypothesis":"Executor configuration must save setup state without arming, injecting a plan, or starting Prewalk work, preventing accidental automatic admission.","result":"The tagged matrix now executes sixty-four real scenarios; all passed with zero lifecycle violations, zero duplicate admissions, and zero unfinished runs. The focused composition checks, typecheck, and complete extension.test.ts module (152 tests) all passed.","consistency_check":"The active source has one matching scorer entry and one matching extension.test.ts title; no active duplicate call site requires the same matrix change.","scope_check":"The diff adds one existing regression to the frozen matrix only; no production behavior, test assertions, labels, or scorer logic changed."}}
{"run":96,"commit":"56fcf73","metric":65,"metrics":{"lifecycle_violations":0,"duplicate_admission":0,"duplicate_continuation":0,"stale_recovery":0,"unfinished_run":0,"failed_scenarios":0},"status":"keep","description":"Add unknown mutation-trigger filtering coverage; coverage rose from 64 to 65 with zero lifecycle violations.","timestamp":1787216024113,"segment":10,"confidence":3.9310344827586206,"asi":{"hypothesis":"Unknown mutation-like results must not satisfy automatic admission early, while a later valid mutation still triggers exactly once.","result":"The tagged matrix now executes sixty-five real scenarios; all passed with zero lifecycle violations, zero duplicate admissions, and zero duplicate continuations. The focused composition checks, typecheck, and complete extension.test.ts module (152 tests) all passed.","consistency_check":"The active source has one matching scorer entry and one matching extension.test.ts title; no active duplicate call site requires the same matrix change.","scope_check":"The diff adds one existing regression to the frozen matrix only; no production behavior, test assertions, labels, or scorer logic changed."}}
{"run":97,"commit":"b6ecffc","metric":66,"metrics":{"lifecycle_violations":0,"duplicate_admission":0,"duplicate_continuation":0,"stale_recovery":0,"unfinished_run":0,"failed_scenarios":0},"status":"keep","description":"Add active-turn admission guard coverage; coverage rose from 65 to 66 with zero lifecycle violations.","timestamp":1787216225689,"segment":10,"confidence":3.8666666666666667,"asi":{"hypothesis":"Manual /prewalk run must fail closed during an active agent turn and only arm after the host becomes idle, preventing duplicate admission.","result":"The tagged matrix now executes sixty-six real scenarios; all passed with zero lifecycle violations, zero duplicate admissions, and zero duplicate continuations. The focused composition checks, typecheck, and complete extension.test.ts module (152 tests) all passed.","consistency_check":"The active source has one matching scorer entry and one matching extension.test.ts title; no active duplicate call site requires the same matrix change.","scope_check":"The diff adds one existing regression to the frozen matrix only; no production behavior, test assertions, labels, or scorer logic changed."}}
{"run":98,"commit":"a96d434","metric":67,"metrics":{"lifecycle_violations":0,"duplicate_admission":0,"duplicate_continuation":0,"stale_recovery":0,"unfinished_run":0,"failed_scenarios":0},"status":"keep","description":"Add automatic-session admission boundary coverage; coverage rose from 66 to 67 with zero lifecycle violations.","timestamp":1787216435950,"segment":10,"confidence":3.933333333333333,"asi":{"hypothesis":"Config-enabled automatic admission applies to fresh sessions but must not resume or re-admit work in resumed sessions, preserving session ownership.","result":"The tagged matrix now executes sixty-seven real scenarios; all passed with zero lifecycle violations, zero duplicate admissions, and zero duplicate continuations. The focused composition checks, typecheck, and complete extension.test.ts module (152 tests) all passed.","consistency_check":"The active source has one matching scorer entry and one matching extension.test.ts title; no active duplicate call site requires the same matrix change.","scope_check":"The diff adds one existing regression to the frozen matrix only; no production behavior, test assertions, labels, or scorer logic changed."}}
{"run":99,"commit":"a9a03a2","metric":68,"metrics":{"lifecycle_violations":0,"duplicate_admission":0,"duplicate_continuation":0,"stale_recovery":0,"unfinished_run":0,"failed_scenarios":0},"status":"keep","description":"Add automatic cancellation reload-state coverage; coverage rose from 67 to 68 with zero lifecycle violations.","timestamp":1787216665172,"segment":10,"confidence":4,"asi":{"hypothesis":"A session that explicitly cancels automatic mode must remain disabled after reload even when the persistent default is enabled, preventing duplicate admission.","result":"The tagged matrix now executes sixty-eight real scenarios; all passed with zero lifecycle violations, zero duplicate admissions, and zero duplicate continuations. The focused composition checks, typecheck, and complete extension.test.ts module (152 tests) all passed.","consistency_check":"The active source has one matching scorer entry and one matching extension.test.ts title; no active duplicate call site requires the same matrix change.","scope_check":"The diff adds one existing regression to the frozen matrix only; no production behavior, test assertions, labels, or scorer logic changed."}}
{"run":100,"commit":"518fef6","metric":69,"metrics":{"lifecycle_violations":0,"duplicate_admission":0,"duplicate_continuation":0,"stale_recovery":0,"unfinished_run":0,"failed_scenarios":0},"status":"keep","description":"Add automatic default/opt-in persistence coverage; coverage rose from 68 to 69 with zero lifecycle violations.","timestamp":1787216895073,"segment":10,"confidence":3.935483870967742,"asi":{"hypothesis":"Automatic admission defaults off, while an explicit session opt-in survives reload without silently enabling unrelated sessions, preventing duplicate admission.","result":"The tagged matrix now executes sixty-nine real scenarios; all passed with zero lifecycle violations, zero duplicate admissions, and zero duplicate continuations. The focused composition checks, typecheck, and complete extension.test.ts module (152 tests) all passed.","consistency_check":"The active source has one matching scorer entry and one matching extension.test.ts title; no active duplicate call site requires the same change.","scope_check":"The diff adds one existing regression to the frozen matrix only; no production behavior, test assertions, labels, or scorer logic changed."}}
{"run":101,"commit":"5c5e8d8","metric":70,"metrics":{"lifecycle_violations":0,"duplicate_admission":0,"duplicate_continuation":0,"stale_recovery":0,"unfinished_run":0,"failed_scenarios":0},"status":"keep","description":"Add automatic-cancel no-run coverage; coverage rose from 69 to 70 with zero lifecycle violations.","timestamp":1787217139298,"segment":10,"confidence":3.875,"asi":{"hypothesis":"Cancelling automatic mode must only change admission state and must not arm, inject a plan, or start a run.","result":"The tagged matrix now executes seventy real scenarios; all passed with zero lifecycle violations, zero duplicate admissions, and zero duplicate continuations. The focused composition checks, typecheck, and complete extension.test.ts module (152 tests) all passed.","consistency_check":"The active source has one matching scorer entry and one matching extension.test.ts title; no active duplicate call site requires the same change.","scope_check":"The diff adds one existing regression to the frozen matrix only; no production behavior, test assertions, labels, or scorer logic changed."}}
{"run":102,"commit":"94784a9","metric":71,"metrics":{"lifecycle_violations":0,"duplicate_admission":0,"duplicate_continuation":0,"stale_recovery":0,"unfinished_run":0,"failed_scenarios":0},"status":"keep","description":"Add multi-turn substantial-work assessment coverage; coverage rose from 70 to 71 with zero lifecycle violations.","timestamp":1787217383392,"segment":10,"confidence":3.9375,"asi":{"hypothesis":"A substantial automatic request spanning turns must wait for its valid assessment and queue exactly one plan, preventing early or duplicate admission.","result":"The tagged matrix now executes seventy-one real scenarios; all passed with zero lifecycle violations, zero duplicate admissions, and zero duplicate continuations. The focused composition checks, typecheck, and complete extension.test.ts module (152 tests) all passed.","consistency_check":"The active source has one matching scorer entry and one matching extension.test.ts title; no active duplicate call site requires the same change.","scope_check":"The diff adds one existing regression to the frozen matrix only; no production behavior, test assertions, labels, or scorer logic changed."}}
{"run":103,"commit":"8e2b18c","metric":72,"metrics":{"lifecycle_violations":0,"duplicate_admission":0,"duplicate_continuation":0,"stale_recovery":0,"unfinished_run":0,"failed_scenarios":0},"status":"keep","description":"Add assessment tool-gate coverage; coverage rose from 71 to 72 with zero lifecycle violations.","timestamp":1787217609877,"segment":10,"confidence":4,"asi":{"hypothesis":"Mutation-capable tools remain blocked until assessment, while read-only inspection is allowed, preventing automatic admission from bypassing the assessment gate.","result":"The tagged matrix now executes seventy-two real scenarios; all passed with zero lifecycle violations, zero duplicate admissions, and zero duplicate continuations. The focused composition checks, typecheck, and complete extension.test.ts module (152 tests) all passed.","consistency_check":"The active source has one matching scorer entry and one matching extension.test.ts title; no active duplicate call site requires the same change.","scope_check":"The diff adds one existing regression to the frozen matrix only; no production behavior, test assertions, labels, or scorer logic changed."}}
{"run":104,"commit":"844ca48","metric":73,"metrics":{"lifecycle_violations":0,"duplicate_admission":0,"duplicate_continuation":0,"stale_recovery":0,"unfinished_run":0,"failed_scenarios":0},"status":"keep","description":"Add assessment inspection/mutation outcome coverage; coverage rose from 72 to 73 with zero lifecycle violations.","timestamp":1787217825302,"segment":10,"confidence":3.9393939393939394,"asi":{"hypothesis":"Read-only exec inspection remains allowed during assessment while failed mutation attempts do not bypass or corrupt the assessment gate.","result":"The tagged matrix now executes seventy-three real scenarios; all passed with zero lifecycle violations, zero duplicate admissions, and zero duplicate continuations. The focused composition checks, typecheck, and complete extension.test.ts module (152 tests) all passed.","consistency_check":"The active source has one matching scorer entry and one matching extension.test.ts title; no active duplicate call site requires the same change.","scope_check":"The diff adds one existing regression to the frozen matrix only; no production behavior, test assertions, labels, or scorer logic changed."}}
{"run":105,"commit":"75c0f1e","metric":74,"metrics":{"lifecycle_violations":0,"duplicate_admission":0,"duplicate_continuation":0,"stale_recovery":0,"unfinished_run":0,"failed_scenarios":0},"status":"keep","description":"Add approved-plan bypass and tool-slate restoration coverage; coverage rose from 73 to 74 with zero lifecycle violations.","timestamp":1787218044538,"segment":10,"confidence":3.8823529411764706,"asi":{"hypothesis":"A completed approved plan must bypass without injecting another plan, restore the exact original tool slate, and remove the provider overlay to prevent duplicate admission.","result":"The tagged matrix now executes seventy-four real scenarios; all passed with zero lifecycle violations, zero duplicate admissions, and zero duplicate continuations. The focused composition checks, typecheck, and complete extension.test.ts module (152 tests) all passed.","consistency_check":"The active source has one matching scorer entry and one matching extension.test.ts title; no active duplicate call site requires the same change.","scope_check":"The diff adds one existing regression to the frozen matrix only; no production behavior, test assertions, labels, or scorer logic changed."}}
{"run":106,"commit":"4847559","metric":75,"metrics":{"lifecycle_violations":0,"duplicate_admission":0,"duplicate_continuation":0,"stale_recovery":0,"unfinished_run":0,"failed_scenarios":0},"status":"keep","description":"Add Markdown-only handoff classification coverage; coverage rose from 74 to 75 with zero lifecycle violations.","timestamp":1787218370676,"segment":10,"confidence":3.9411764705882355,"asi":{"hypothesis":"Documentation-only edits must keep the planner active until code work appears, preventing premature executor handoff while still allowing the later valid handoff.","result":"The tagged matrix now executes seventy-five real scenarios; all passed with zero lifecycle violations, zero duplicate continuations, and zero unfinished runs. The focused composition checks, typecheck, and complete extension.test.ts module (152 tests) all passed.","consistency_check":"The duplicate assessment candidate was removed after finding an existing identical scorer entry; the active source now has one matching scorer entry and one matching test title.","scope_check":"The diff adds one distinct existing regression to the frozen matrix only; no production behavior, test assertions, labels, or scorer logic changed."}}
{"run":107,"commit":"6b83a0b","metric":76,"metrics":{"lifecycle_violations":0,"duplicate_admission":0,"duplicate_continuation":0,"stale_recovery":0,"unfinished_run":0,"failed_scenarios":0},"status":"keep","description":"Add mutation-tool-unavailable fail-closed coverage; coverage rose from 75 to 76 with zero lifecycle violations.","timestamp":1787218551629,"segment":10,"confidence":4,"asi":{"hypothesis":"When no active mutation-capable tool can prove the first edit, Prewalk must fail before planning and leave the original read-only tool slate untouched.","result":"The tagged matrix now executes seventy-six real scenarios; all passed with zero lifecycle violations, zero unfinished runs, and zero duplicate admissions. The focused composition checks, typecheck, and complete extension.test.ts module (152 tests) all passed.","consistency_check":"The exact test title appears once in extension.test.ts and once as its scorer pattern; the new scenario ID appears once. The sibling parameterized proving-path test remains unchanged and covers all accepted mutation tools.","scope_check":"The diff adds one existing regression to the frozen matrix only; no production behavior, test assertions, labels, or scorer logic changed."}}
{"run":108,"commit":"7c0ded5","metric":77,"metrics":{"lifecycle_violations":0,"duplicate_admission":0,"duplicate_continuation":0,"stale_recovery":0,"unfinished_run":0,"failed_scenarios":0},"status":"keep","description":"Add planner abort-recovery continuity coverage; coverage rose from 76 to 77 with zero lifecycle violations.","timestamp":1787218726936,"segment":10,"confidence":3.942857142857143,"asi":{"hypothesis":"Persisted planner reasoning should be replayed after repeated aborts without replacing the run, creating only the valid continuation and preserving the durable todo trajectory.","result":"The tagged matrix now executes seventy-seven real scenarios; all passed with zero lifecycle violations, zero duplicate continuations, and zero stale-recovery failures. The focused composition checks, typecheck, and complete extension.test.ts module (152 tests) all passed.","consistency_check":"The exact test title appears once in extension.test.ts and once as its scorer pattern; the new scenario ID appears once. Existing delayed-run, aborted-idle, and stale-todo replay scenarios were checked and were already covered.","scope_check":"The diff adds one distinct existing regression to the frozen matrix only; no production behavior, test assertions, labels, or scorer logic changed."}}
{"run":109,"commit":"f769e63","metric":78,"metrics":{"lifecycle_violations":0,"duplicate_admission":0,"duplicate_continuation":0,"stale_recovery":0,"unfinished_run":0,"failed_scenarios":0},"status":"keep","description":"Add automatic source-ownership guard coverage; coverage rose from 77 to 78 with zero lifecycle violations.","timestamp":1787218912250,"segment":10,"confidence":3.888888888888889,"asi":{"hypothesis":"Extension-sourced and streaming input must be ignored while automatic admission is ready, preserving source ownership and preventing duplicate admission.","result":"The tagged matrix now executes seventy-eight real scenarios; all passed with zero lifecycle violations, zero duplicate admissions, and zero duplicate continuations. The focused composition checks, typecheck, and complete extension.test.ts module (152 tests) all passed.","consistency_check":"The exact test title appears once in extension.test.ts and once as its scorer pattern; the new scenario ID appears once. The existing scored scenarios were checked before adding this distinct source-ownership case.","scope_check":"The diff adds one existing regression to the frozen matrix only; no production behavior, test assertions, labels, or scorer logic changed."}}
{"run":110,"commit":"b922bd4","metric":79,"metrics":{"lifecycle_violations":0,"duplicate_admission":0,"duplicate_continuation":0,"stale_recovery":0,"unfinished_run":0,"failed_scenarios":0},"status":"keep","description":"Add bounded planner-recovery coverage; coverage rose from 78 to 79 with zero lifecycle violations.","timestamp":1787219079762,"segment":10,"confidence":3.9444444444444446,"asi":{"hypothesis":"Repeated planner aborts must stop at the configured recovery limit, finalize as failed, and restore the base provider instead of leaving an unbounded unfinished run.","result":"The tagged matrix now executes seventy-nine real scenarios; all passed with zero lifecycle violations, zero unfinished runs, and zero duplicate continuations. The focused composition checks, typecheck, and complete extension.test.ts module (152 tests) all passed.","consistency_check":"The exact test title appears once in extension.test.ts and once as its scorer pattern; the new scenario ID appears once. The existing single-run abort replay and source-ownership scenarios remain distinct and unchanged.","scope_check":"The diff adds one existing regression to the frozen matrix only; no production behavior, test assertions, labels, or scorer logic changed."}}
{"run":111,"commit":"4e47dec","metric":80,"metrics":{"lifecycle_violations":0,"duplicate_admission":0,"duplicate_continuation":0,"stale_recovery":0,"unfinished_run":0,"failed_scenarios":0},"status":"keep","description":"Add permissive direct-tool execution coverage; coverage rose from 79 to 80 with zero lifecycle violations.","timestamp":1787219252723,"segment":10,"confidence":4,"asi":{"hypothesis":"A registered Prewalk tool invoked directly without a host claim must execute successfully under permissive unknown handling, rather than being rejected as an unknown event.","result":"The tagged matrix now executes eighty real scenarios; all passed with zero lifecycle violations, zero duplicate admissions, and zero duplicate continuations. The focused composition checks, typecheck, and complete extension.test.ts module (152 tests) all passed.","consistency_check":"The exact test title appears once in extension.test.ts and once as its scorer pattern; the new scenario ID appears once. The preceding recovery-limit and source-ownership entries remain distinct.","scope_check":"The diff adds one existing regression to the frozen matrix only; no production behavior, test assertions, labels, or scorer logic changed."}}
