{"run":76,"commit":"e85953f","metric":45,"metrics":{"lifecycle_violations":0,"duplicate_admission":0,"duplicate_continuation":0,"stale_recovery":0,"unfinished_run":0,"failed_scenarios":0},"status":"keep","description":"Add settled executor-failure retry coverage; coverage rose from 44 to 45 with zero lifecycle violations.","timestamp":1787212753900,"segment":10,"confidence":3.8947368421052633,"asi":{"hypothesis":"A settled executor failure must remain visible while releasing routing so a subsequent run can start cleanly without stale state or an unfinished route.","result":"The tagged matrix now executes forty-five real scenarios; all passed with zero lifecycle violations, zero unfinished runs, and zero duplicate continuations. The focused composition checks, typecheck, and complete extension.test.ts module (152 tests) all passed.","consistency_check":"The active source has one matching scorer entry and one matching extension.test.ts title; no active duplicate call site requires the same matrix change.","scope_check":"The diff adds one existing regression to the frozen matrix only; no production behavior, test assertions, labels, or scorer logic changed."}}
{"run":77,"commit":"2670278","metric":46,"metrics":{"lifecycle_violations":0,"duplicate_admission":0,"duplicate_continuation":0,"stale_recovery":0,"unfinished_run":0,"failed_scenarios":0},"status":"keep","description":"Add transient executor-failure retry coverage; coverage rose from 45 to 46 with zero lifecycle violations.","timestamp":1787212879822,"segment":10,"confidence":3.8,"asi":{"hypothesis":"A transient executor failure must retain the route lease for a retry and clear the failure state when the next stream succeeds, rather than prematurely terminating the run.","result":"The tagged matrix now executes forty-six real scenarios; all passed with zero lifecycle violations, zero unfinished runs, and zero duplicate continuations. The focused composition checks, typecheck, and complete extension.test.ts module (152 tests) all passed.","consistency_check":"The active source has one matching scorer entry and one matching extension.test.ts title; no active duplicate call site requires the same matrix change.","scope_check":"The diff adds one existing regression to the frozen matrix only; no production behavior, test assertions, labels, or scorer logic changed."}}
{"run":78,"commit":"4d2e1f1","metric":47,"metrics":{"lifecycle_violations":0,"duplicate_admission":0,"duplicate_continuation":0,"stale_recovery":0,"unfinished_run":0,"failed_scenarios":0},"status":"keep","description":"Add native-provider installation coverage; coverage rose from 46 to 47 with zero lifecycle violations.","timestamp":1787213010861,"segment":10,"confidence":3.9,"asi":{"hypothesis":"Prewalk must install its route from Pi's built-in provider stream when no conversion extension is present, without leaving an unfinished route.","result":"The tagged matrix now executes forty-seven real scenarios; all passed with zero lifecycle violations, zero unfinished runs, and zero duplicate continuations. The focused composition checks, typecheck, and complete extension.test.ts module (152 tests) all passed.","consistency_check":"The active source has one matching scorer entry and one matching extension.test.ts title; no active duplicate call site requires the same matrix change.","scope_check":"The diff adds one existing regression to the frozen matrix only; no production behavior, test assertions, labels, or scorer logic changed."}}
{"run":79,"commit":"ebfc246","metric":48,"metrics":{"lifecycle_violations":0,"duplicate_admission":0,"duplicate_continuation":0,"stale_recovery":0,"unfinished_run":0,"failed_scenarios":0},"status":"keep","description":"Add manual executor-release coverage; coverage rose from 47 to 48 with zero lifecycle violations.","timestamp":1787213151105,"segment":10,"confidence":4,"asi":{"hypothesis":"Releasing an active executor route must restore the selected planner and prevent re-arming or duplicate continuation, while preserving the released receipt.","result":"The tagged matrix now executes forty-eight real scenarios; all passed with zero lifecycle violations, zero duplicate continuations, and zero unfinished runs. The focused composition checks, typecheck, and complete extension.test.ts module (152 tests) all passed.","consistency_check":"The active source has one matching scorer entry and one matching extension.test.ts title; no active duplicate call site requires the same matrix change.","scope_check":"The diff adds one existing regression to the frozen matrix only; no production behavior, test assertions, labels, or scorer logic changed."}}
{"run":80,"commit":"16421ef","metric":49,"metrics":{"lifecycle_violations":0,"duplicate_admission":0,"duplicate_continuation":0,"stale_recovery":0,"unfinished_run":0,"failed_scenarios":0},"status":"keep","description":"Add reopened-session stale-active recovery coverage; coverage rose from 48 to 49 with zero lifecycle violations.","timestamp":1787213286303,"segment":10,"confidence":3.9047619047619047,"asi":{"hypothesis":"A reopened session with stale active evidence must start on the planner and record the abandoned trajectory as interrupted, rather than resurrecting the executor route.","result":"The tagged matrix now executes forty-nine real scenarios; all passed with zero lifecycle violations, zero stale-recovery failures, and zero duplicate continuations. The focused composition checks, typecheck, and complete extension.test.ts module (152 tests) all passed.","consistency_check":"The active source has one matching scorer entry and one matching extension.test.ts title; no active duplicate call site requires the same matrix change.","scope_check":"The diff adds one existing regression to the frozen matrix only; no production behavior, test assertions, labels, or scorer logic changed."}}
{"run":81,"commit":"4bca2ed","metric":50,"metrics":{"lifecycle_violations":0,"duplicate_admission":0,"duplicate_continuation":0,"stale_recovery":0,"unfinished_run":0,"failed_scenarios":0},"status":"keep","description":"Add journal session-ownership coverage; coverage rose from 49 to 50 with zero lifecycle violations.","timestamp":1787213431563,"segment":10,"confidence":3.8181818181818183,"asi":{"hypothesis":"A fresh journal must remain owned by its original live session, so an unrelated session cannot claim or finalize it as a receipt.","result":"The tagged matrix now executes fifty real scenarios; all passed with zero lifecycle violations, zero stale-recovery failures, and zero duplicate continuations. The focused composition checks, typecheck, and complete extension.test.ts module (152 tests) all passed.","consistency_check":"The active source has one matching scorer entry and one matching extension.test.ts title; no active duplicate call site requires the same matrix change.","scope_check":"The diff adds one existing regression to the frozen matrix only; no production behavior, test assertions, labels, or scorer logic changed."}}
{"run":82,"commit":"b27fc61","metric":51,"metrics":{"lifecycle_violations":0,"duplicate_admission":0,"duplicate_continuation":0,"stale_recovery":0,"unfinished_run":0,"failed_scenarios":0},"status":"keep","description":"Add abandoned-journal recovery coverage; coverage rose from 50 to 51 with zero lifecycle violations.","timestamp":1787213588826,"segment":10,"confidence":3.909090909090909,"asi":{"hypothesis":"A journal abandoned by a dead session must be finalized as interrupted with valid pricing evidence, rather than remaining stale or unfinished.","result":"The tagged matrix now executes fifty-one real scenarios; all passed with zero lifecycle violations, zero stale-recovery failures, and zero duplicate continuations. The focused composition checks, typecheck, and complete extension.test.ts module (152 tests) all passed.","consistency_check":"The active source has one matching scorer entry and one matching extension.test.ts title; no active duplicate call site requires the same matrix change.","scope_check":"The diff adds one existing regression to the frozen matrix only; no production behavior, test assertions, labels, or scorer logic changed."}}
{"run":83,"commit":"2a41f31","metric":52,"metrics":{"lifecycle_violations":0,"duplicate_admission":0,"duplicate_continuation":0,"stale_recovery":0,"unfinished_run":0,"failed_scenarios":0},"status":"keep","description":"Add repaired-startup retry coverage; coverage rose from 51 to 52 with zero lifecycle violations.","timestamp":1787213763529,"segment":10,"confidence":4,"asi":{"hypothesis":"A startup configuration failure repaired before reload must retry setup and restore the planner route instead of remaining failed or leaving stale state.","result":"The tagged matrix now executes fifty-two real scenarios; all passed with zero lifecycle violations, zero stale-recovery failures, and zero duplicate continuations. The focused composition checks, typecheck, and complete extension.test.ts module (152 tests) all passed.","consistency_check":"The active source has one matching scorer entry and one matching extension.test.ts title; no active duplicate call site requires the same matrix change.","scope_check":"The diff adds one existing regression to the frozen matrix only; no production behavior, test assertions, labels, or scorer logic changed."}}
{"run":84,"commit":"6651616","metric":53,"metrics":{"lifecycle_violations":0,"duplicate_admission":0,"duplicate_continuation":0,"stale_recovery":0,"unfinished_run":0,"failed_scenarios":0},"status":"keep","description":"Add slash-cancellation release routing coverage; coverage rose from 52 to 53 with zero lifecycle violations.","timestamp":1787213919745,"segment":10,"confidence":3.9130434782608696,"asi":{"hypothesis":"Slash cancellation must respect route phase: an active executor route should be directed to release instead of being cancelled or re-armed through the wrong lifecycle path.","result":"The tagged matrix now executes fifty-three real scenarios; all passed with zero lifecycle violations, zero duplicate continuations, and zero unfinished runs. The focused composition checks, typecheck, and complete extension.test.ts module (152 tests) all passed.","consistency_check":"The active source has one matching scorer entry and one matching extension.test.ts title; no active duplicate call site requires the same matrix change.","scope_check":"The diff adds one existing regression to the frozen matrix only; no production behavior, test assertions, labels, or scorer logic changed."}}
{"run":85,"commit":"643be6b","metric":54,"metrics":{"lifecycle_violations":0,"duplicate_admission":0,"duplicate_continuation":0,"stale_recovery":0,"unfinished_run":0,"failed_scenarios":0},"status":"keep","description":"Add hidden-guidance scrubbing coverage; coverage rose from 53 to 54 with zero lifecycle violations.","timestamp":1787214087317,"segment":10,"confidence":3.8333333333333335,"asi":{"hypothesis":"Cancellation and compaction must scrub hidden Prewalk guidance while retaining ordinary context, preventing internal plan leakage across lifecycle boundaries.","result":"The tagged matrix now executes fifty-four real scenarios; all passed with zero lifecycle violations, zero duplicate continuations, and zero unfinished runs. The focused composition checks, typecheck, and complete extension.test.ts module (152 tests) all passed.","consistency_check":"The active source has one matching scorer entry and one matching extension.test.ts title; unrelated git lost-found copies are not active call sites.","scope_check":"The diff adds one existing regression to the frozen matrix only; no production behavior, test assertions, labels, or scorer logic changed."}}
{"run":86,"commit":"3060165","metric":55,"metrics":{"lifecycle_violations":0,"duplicate_admission":0,"duplicate_continuation":0,"stale_recovery":0,"unfinished_run":0,"failed_scenarios":0},"status":"keep","description":"Add active executor manual-compaction coverage; coverage rose from 54 to 55 with zero lifecycle violations.","timestamp":1787214240543,"segment":10,"confidence":3.9166666666666665,"asi":{"hypothesis":"An active executor route must survive a manual compaction without demotion or duplicate continuation; the selected generated case runs exactly one parameterized scenario.","result":"The tagged matrix now executes fifty-five real scenarios; all passed with zero lifecycle violations, zero duplicate continuations, and zero unfinished runs. The focused composition checks, typecheck, and complete extension.test.ts module (152 tests) all passed.","consistency_check":"The active scorer entry targets the generated manual parameter case and the source has one parameterized test definition; the focused run confirmed exactly one test passed.","scope_check":"The diff adds one existing regression case to the frozen matrix only; no production behavior, test assertions, labels, or scorer logic changed."}}
{"run":87,"commit":"7d16827","metric":56,"metrics":{"lifecycle_violations":0,"duplicate_admission":0,"duplicate_continuation":0,"stale_recovery":0,"unfinished_run":0,"failed_scenarios":0},"status":"keep","description":"Add active executor overflow-compaction coverage; coverage rose from 55 to 56 with zero lifecycle violations.","timestamp":1787214397394,"segment":10,"confidence":4,"asi":{"hypothesis":"Overflow compaction must preserve active executor routing and avoid duplicate continuation, complementing the manual compaction case without changing the parameterized test.","result":"The tagged matrix now executes fifty-six real scenarios; all passed with zero lifecycle violations, zero duplicate continuations, and zero unfinished runs. The focused composition checks, typecheck, and complete extension.test.ts module (152 tests) all passed.","consistency_check":"The active scorer entry targets the generated overflow parameter case and the source has one parameterized test definition; the focused run confirmed exactly one test passed.","scope_check":"The diff adds one existing regression case to the frozen matrix only; no production behavior, test assertions, labels, or scorer logic changed."}}
{"run":88,"commit":"37ca995","metric":57,"metrics":{"lifecycle_violations":0,"duplicate_admission":0,"duplicate_continuation":0,"stale_recovery":0,"unfinished_run":0,"failed_scenarios":0},"status":"keep","description":"Add active executor threshold-compaction coverage; coverage rose from 56 to 57 with zero lifecycle violations.","timestamp":1787214549854,"segment":10,"confidence":3.92,"asi":{"hypothesis":"Threshold compaction must preserve active executor routing and avoid duplicate continuation, completing the three distinct manual, overflow, and threshold triggers.","result":"The tagged matrix now executes fifty-seven real scenarios; all passed with zero lifecycle violations, zero duplicate continuations, and zero unfinished runs. The focused composition checks, typecheck, and complete extension.test.ts module (152 tests) all passed.","consistency_check":"The active scorer entry targets the generated threshold parameter case and the source has one parameterized test definition; the focused run confirmed exactly one test passed.","scope_check":"The diff adds one existing regression case to the frozen matrix only; no production behavior, test assertions, labels, or scorer logic changed."}}
{"run":89,"commit":"187f42d","metric":58,"metrics":{"lifecycle_violations":0,"duplicate_admission":0,"duplicate_continuation":0,"stale_recovery":0,"unfinished_run":0,"failed_scenarios":0},"status":"keep","description":"Add vanished-executor reload fallback coverage; coverage rose from 57 to 58 with zero lifecycle violations.","timestamp":1787214721537,"segment":10,"confidence":3.8461538461538463,"asi":{"hypothesis":"A restored run whose executor is unavailable must remain on the planner and avoid falsely resurrecting a failed or unusable executor route.","result":"The tagged matrix now executes fifty-eight real scenarios; all passed with zero lifecycle violations, zero stale-recovery failures, and zero unfinished runs. The focused composition checks, typecheck, and complete extension.test.ts module (152 tests) all passed.","consistency_check":"The active source has one matching scorer entry and one matching extension.test.ts title; no active duplicate call site requires the same matrix change.","scope_check":"The diff adds one existing regression to the frozen matrix only; no production behavior, test assertions, labels, or scorer logic changed."}}
{"run":90,"commit":"1fc3588","metric":59,"metrics":{"lifecycle_violations":0,"duplicate_admission":0,"duplicate_continuation":0,"stale_recovery":0,"unfinished_run":0,"failed_scenarios":0},"status":"keep","description":"Add no-executor fail-closed startup coverage; coverage rose from 58 to 59 with zero lifecycle violations.","timestamp":1787214887298,"segment":10,"confidence":3.923076923076923,"asi":{"hypothesis":"When no executor candidate resolves, Prewalk must remain unarmed and notify without taking down the session or creating an unfinished handoff.","result":"The tagged matrix now executes fifty-nine real scenarios; all passed with zero lifecycle violations, zero unfinished runs, and zero duplicate continuations. The focused composition checks, typecheck, and complete extension.test.ts module (152 tests) all passed.","consistency_check":"The active source has one matching scorer entry and one matching extension.test.ts title; no active duplicate call site requires the same matrix change.","scope_check":"The diff adds one existing regression to the frozen matrix only; no production behavior, test assertions, labels, or scorer logic changed."}}
{"run":91,"commit":"4f90753","metric":60,"metrics":{"lifecycle_violations":0,"duplicate_admission":0,"duplicate_continuation":0,"stale_recovery":0,"unfinished_run":0,"failed_scenarios":0},"status":"keep","description":"Add unauthorized-executor fail-closed coverage; coverage rose from 59 to 60 with zero lifecycle violations.","timestamp":1787215069416,"segment":10,"confidence":4,"asi":{"hypothesis":"When the executor lacks configured authentication, Prewalk must remain unarmed and notify without attempting an unsafe or unfinished handoff.","result":"The tagged matrix now executes sixty real scenarios; all passed with zero lifecycle violations, zero unfinished runs, and zero duplicate continuations. The focused composition checks, typecheck, and complete extension.test.ts module (152 tests) all passed.","consistency_check":"The active source has one matching scorer entry and one matching extension.test.ts title; no active duplicate call site requires the same matrix change.","scope_check":"The diff adds one existing regression to the frozen matrix only; no production behavior, test assertions, labels, or scorer logic changed."}}
{"run":92,"commit":"d31e648","metric":61,"metrics":{"lifecycle_violations":0,"duplicate_admission":0,"duplicate_continuation":0,"stale_recovery":0,"unfinished_run":0,"failed_scenarios":0},"status":"keep","description":"Add fallback executor selection coverage; coverage rose from 60 to 61 with zero lifecycle violations.","timestamp":1787215246440,"segment":10,"confidence":3.925925925925926,"asi":{"hypothesis":"When the primary executor is missing, a configured fallback must be selected for a valid plan injection rather than leaving an unfinished or unusable route.","result":"The tagged matrix now executes sixty-one real scenarios; all passed with zero lifecycle violations, zero unfinished runs, and zero duplicate continuations. The focused composition checks, typecheck, and complete extension.test.ts module (152 tests) all passed.","consistency_check":"The active source has one matching scorer entry and one matching extension.test.ts title; no active duplicate call site requires the same matrix change.","scope_check":"The diff adds one existing regression to the frozen matrix only; no production behavior, test assertions, labels, or scorer logic changed."}}
{"run":93,"commit":"c47fce5","metric":62,"metrics":{"lifecycle_violations":0,"duplicate_admission":0,"duplicate_continuation":0,"stale_recovery":0,"unfinished_run":0,"failed_scenarios":0},"status":"keep","description":"Add inferred fallback-chain coverage; coverage rose from 61 to 62 with zero lifecycle violations.","timestamp":1787215439761,"segment":10,"confidence":3.857142857142857,"asi":{"hypothesis":"When executorFallbacks is omitted, Prewalk should infer an available fallback and produce a valid plan rather than leaving an unfinished or unusable route.","result":"The tagged matrix now executes sixty-two real scenarios; all passed with zero lifecycle violations, zero unfinished runs, and zero duplicate continuations. The focused composition checks, typecheck, and complete extension.test.ts module (152 tests) all passed.","consistency_check":"The active source has one matching scorer entry and one matching extension.test.ts title; no active duplicate call site requires the same matrix change.","scope_check":"The diff adds one existing regression to the frozen matrix only; no production behavior, test assertions, labels, or scorer logic changed."}}
