{"run":26,"commit":"f626dd1","metric":9210,"metrics":{"underestimation_rate_ppm":76347,"p95_under_tokens":274,"p95_over_tokens":729,"reserve_breach_underestimates":0,"threshold_false_positives":3,"threshold_false_negatives":0,"rows":2803,"models":4},"status":"discard","description":"Train-only 448-token context margin; it was worse than the 352 research finalist and the accepted 384 production margin.","timestamp":1787204985505,"segment":6,"confidence":0.4444444444444444,"asi":{"hypothesis":"A larger margin might improve asymmetric loss by further reducing underestimation.","rollback_reason":"Train weighted error rose to 9210 and safety counts were unchanged.","next_action_hint":"Discard and test 480."}}
{"run":27,"commit":"f626dd1","metric":9252,"metrics":{"underestimation_rate_ppm":71352,"p95_under_tokens":242,"p95_over_tokens":761,"reserve_breach_underestimates":0,"threshold_false_positives":4,"threshold_false_negatives":0,"rows":2803,"models":4},"status":"discard","description":"Train-only 480-token context margin; it was worse than the 352 finalist and exceeded the three-false-positive safety cap even on train.","timestamp":1787205008197,"segment":6,"confidence":0.2727272727272727,"asi":{"hypothesis":"A 480-token margin might be the largest useful nearby safety margin before early-compaction errors dominate.","rollback_reason":"Train weighted error rose to 9252 and threshold false positives increased to four, above the safety cap.","next_action_hint":"Stop the broad nearby search; validate 352 and 384 rather than spending runs on more train-only guesses."}}
{"run":28,"commit":"7c72a8f","metric":9047,"metrics":{"underestimation_rate_ppm":105660,"p95_under_tokens":260,"p95_over_tokens":507,"reserve_breach_underestimates":0,"threshold_false_positives":0,"threshold_false_negatives":0,"rows":795,"models":4},"status":"keep","description":"Validation comparison for the 352-token context finalist; it improves validation loss with zero threshold mistakes but remains below the 1% promotion threshold relative to train.","timestamp":1787205033718,"segment":6,"confidence":4.833333333333333,"asi":{"hypothesis":"The small train improvement at 352 should reproduce on the separate validation split without introducing threshold misses.","result":"Validation error was 9047 with zero threshold false positives or false negatives; the gain is still too small to justify production change before holdout."}}
{"run":29,"commit":"74191a6","metric":8959,"metrics":{"underestimation_rate_ppm":94340,"p95_under_tokens":228,"p95_over_tokens":539,"reserve_breach_underestimates":0,"threshold_false_positives":0,"threshold_false_negatives":0,"rows":795,"models":4},"status":"keep","description":"Validation comparison for the accepted 384-token context margin; it beats the 352 finalist on validation with zero threshold mistakes.","timestamp":1787205053933,"segment":6,"confidence":4.975609756097561,"asi":{"hypothesis":"The existing 384-token production margin should generalize at least as well as the tiny train-leading 352 candidate on validation.","result":"384 scored 8959 versus 9047 for 352, with zero validation threshold false positives and false negatives; retain 384 as the selected candidate."}}
{"run":30,"commit":"74191a6","metric":14356,"metrics":{"underestimation_rate_ppm":113350,"p95_under_tokens":527,"p95_over_tokens":628,"reserve_breach_underestimates":0,"threshold_false_positives":0,"threshold_false_negatives":0,"rows":397,"models":4},"status":"discard","description":"Single post-selection holdout reveal for the selected 384-token context margin; holdout confirmed zero threshold mistakes and was not used to choose a candidate.","timestamp":1787205073683,"segment":6,"confidence":6,"asi":{"hypothesis":"The validation-selected 384-token margin should retain zero threshold false negatives on the untouched holdout.","result":"Holdout weighted error was 14356 with zero threshold false positives and false negatives; the holdout was revealed only after selection.","rollback_reason":"This was an evaluation-only holdout reveal, not a production candidate improvement.","next_action_hint":"Keep production at 384 and move to the independent admission robustness corpus."}}
{"type":"config","name":"Admission robustness search","metricName":"weighted_error","metricUnit":"","bestDirection":"lower"}
{"run":31,"commit":"495933d","metric":4,"metrics":{"false_negatives":0,"false_positives":4,"must_admit_misses":0,"accuracy_ppm":875000,"rows":32,"families":8},"status":"keep","description":"Independent admission-robustness train baseline for the accepted classifier.","timestamp":1787205365543,"segment":7,"confidence":null,"asi":{"hypothesis":"The frozen robustness corpus should expose only the intended new negation gap on train while the original 16-case admission suite remains green.","result":"Train weighted error was 4 from four new negation false positives; no must-admit misses, all 16 original tests, and typecheck passed."}}
{"run":32,"commit":"a7a769d","metric":1,"metrics":{"false_negatives":0,"false_positives":1,"must_admit_misses":0,"accuracy_ppm":968750,"rows":32,"families":8},"status":"keep","description":"Admission robustness candidate covering direct no-change negation forms; train errors fell from 4 to 1 while original tests stayed green.","timestamp":1787205411602,"segment":7,"confidence":null,"asi":{"hypothesis":"A narrow fail-closed pattern for do-not/without making, any, or code changes should remove the new negation false positives without broadening admission.","result":"Train weighted error fell to 1; the remaining train false positive is the separate with-no-code-changes variant. Original admission tests and typecheck passed."}}
{"run":33,"commit":"788e996","metric":0,"metrics":{"false_negatives":0,"false_positives":0,"must_admit_misses":0,"accuracy_ppm":1000000,"rows":32,"families":8},"status":"keep","description":"Admission robustness candidate for the remaining with-no-code-changes form; train robustness error reached zero with the original suite still green.","timestamp":1787205446880,"segment":7,"confidence":null,"asi":{"hypothesis":"A separate narrow with-no-code-changes bypass should close the last train robustness false positive without changing substantial-work admission.","result":"Train weighted error and must-admit misses reached zero; original admission tests and typecheck passed."}}
{"type":"config","name":"Admission robustness validation","metricName":"weighted_error","metricUnit":"","bestDirection":"lower"}
{"run":34,"commit":"22ea922","metric":5,"metrics":{"false_negatives":1,"false_positives":0,"must_admit_misses":1,"accuracy_ppm":937500,"rows":16,"families":4},"status":"keep","description":"Validation baseline for the two accepted narrow negation patterns before testing the separate spanning hypothesis.","timestamp":1787205500374,"segment":8,"confidence":null,"asi":{"hypothesis":"The negation-only candidate should remove validation false positives while leaving the independent spanning must-admit case visible.","result":"Validation weighted error is 5 from one spanning must-admit miss; negation false positives are zero and original tests pass."}}
{"run":35,"commit":"dde1499","metric":0,"metrics":{"false_negatives":0,"false_positives":0,"must_admit_misses":0,"accuracy_ppm":1000000,"rows":16,"families":4},"status":"keep","description":"Validation finalist adding the labeled spanning lexical variant; it removes the independent must-admit miss without affecting negation safety or original tests.","timestamp":1787205543378,"segment":8,"confidence":null,"asi":{"hypothesis":"Treating a clearly cross-cutting feature that spans multiple product layers like the existing across/cross-cutting markers should close the validation must-admit miss without broad classifier expansion.","result":"Validation weighted error fell from 5 to 0, with zero false positives and zero must-admit misses; original tests and typecheck passed."}}
{"run":36,"commit":"dde1499","metric":0,"metrics":{"false_negatives":0,"false_positives":0,"must_admit_misses":0,"accuracy_ppm":1000000,"rows":16,"families":4},"status":"discard","description":"Single post-selection robustness holdout reveal for the combined admission finalist; it generalizes with zero errors and no must-admit misses.","timestamp":1787205593251,"segment":8,"confidence":null,"asi":{"hypothesis":"The validation-selected negation plus spanning candidate should generalize to unseen lexical families.","result":"Holdout weighted error, false positives, false negatives, and must-admit misses were all zero; original 48-case corpus also remained perfect.","rollback_reason":"Evaluation-only holdout reveal after selection; no additional source change was proposed.","next_action_hint":"Retain the narrow admission patterns and move to composition coverage."}}
{"type":"config","name":"Prewalk composition coverage","metricName":"lifecycle_violations","metricUnit":"","bestDirection":"lower"}
{"run":37,"commit":"dde1499","metric":0,"metrics":{"duplicate_admission":0,"duplicate_continuation":0,"stale_recovery":0,"unfinished_run":0,"scenarios":8,"failed_scenarios":0},"status":"checks_failed","description":"Composition matrix passed all eight tagged scenarios, but the focused typecheck rejected the test fixture's unsupported nextTurn delivery type.","timestamp":1787206567065,"segment":9,"confidence":null,"asi":{"hypothesis":"Adding a real next-turn extension continuation scenario should broaden composition coverage without production changes.","result":"The scenario matrix passed, but TypeScript correctly reported that Pi's sendUserMessage delivery type supports steer/followUp, not nextTurn.","rollback_reason":"Checks failed on the fixture type error; log_experiment restored the pre-candidate tree.","next_action_hint":"Use the supported steer delivery mode for the extension continuation scenario, then rerun the full composition matrix and checks."}}
{"run":38,"commit":"1b0c119","metric":0,"metrics":{"duplicate_admission":0,"duplicate_continuation":0,"stale_recovery":0,"unfinished_run":0,"scenarios":8,"failed_scenarios":0},"status":"keep","description":"Composition coverage baseline with tagged admission, continuation, mutation, todo, compaction, termination, and shutdown scenarios.","timestamp":1787206679234,"segment":9,"confidence":null,"asi":{"hypothesis":"The expanded real-test matrix should preserve the fail-closed extension boundary and expose lifecycle regressions across the requested composition seams.","result":"All eight tagged scenarios passed, the full composition test file passed, and typecheck passed; the earlier fixture type error was corrected by using Pi's supported steer delivery mode."}}
{"type":"config","name":"Composition scenario coverage","metricName":"scenarios","metricUnit":"","bestDirection":"higher"}
{"run":39,"commit":"10fd0e2","metric":8,"metrics":{"lifecycle_violations":0,"duplicate_admission":0,"duplicate_continuation":0,"stale_recovery":0,"unfinished_run":0,"failed_scenarios":0},"status":"keep","description":"Composition scenario-coverage baseline after correcting the steered-continuation tag and documenting robustness split controls.","timestamp":1787208862630,"segment":10,"confidence":null,"asi":{"hypothesis":"The corrected tagged composition matrix should cover eight real admission and lifecycle scenarios with no failures before adding another independent compaction boundary.","result":"Eight scenarios passed with zero lifecycle violations; the full composition file and typecheck passed. The scorer label and robustness-run instructions are now retained for the next coverage increment."}}
{"run":40,"commit":"96ae2f4","metric":9,"metrics":{"lifecycle_violations":0,"duplicate_admission":0,"duplicate_continuation":0,"stale_recovery":0,"unfinished_run":0,"failed_scenarios":0},"status":"keep","description":"Add a real compaction-suppression scenario to the tagged composition matrix; coverage rose from 8 to 9 with zero lifecycle violations.","timestamp":1787208900002,"segment":10,"confidence":null,"asi":{"hypothesis":"The existing disowned-compaction suppression integration test adds an independent lifecycle boundary without changing production behavior or weakening the matrix.","result":"The matrix now executes nine tagged real scenarios; all passed, all lifecycle dimensions remained zero, the full composition file passed, and typecheck passed."}}
{"run":41,"commit":"c375966","metric":10,"metrics":{"lifecycle_violations":0,"duplicate_admission":0,"duplicate_continuation":0,"stale_recovery":0,"unfinished_run":0,"failed_scenarios":0},"status":"keep","description":"Add the stale-settlement replacement-run scenario to composition coverage; coverage rose from 9 to 10 with zero lifecycle violations.","timestamp":1787209021636,"segment":10,"confidence":2,"asi":{"hypothesis":"The existing stale settled-handler regression test covers a distinct replacement-run boundary without changing production policy or weakening any assertion.","result":"The tagged matrix now executes ten real scenarios; all passed with zero lifecycle violations and zero stale-recovery failures, while the full composition file and typecheck remained green."}}
{"run":42,"commit":"efce37d","metric":11,"metrics":{"lifecycle_violations":0,"duplicate_admission":0,"duplicate_continuation":0,"stale_recovery":0,"unfinished_run":0,"failed_scenarios":0},"status":"keep","description":"Add the settled-executor continuation boundary to composition coverage; coverage rose from 10 to 11 with zero lifecycle violations.","timestamp":1787209086089,"segment":10,"confidence":3,"asi":{"hypothesis":"The existing executor-settlement regression test directly probes duplicate-continuation prevention, the most relevant uncovered boundary after stale settlement coverage.","result":"The tagged matrix now executes eleven real scenarios; all passed with zero lifecycle violations and zero duplicate-continuation failures, while the full composition file and typecheck remained green."}}
{"run":43,"commit":"63da98a","metric":12,"metrics":{"lifecycle_violations":0,"duplicate_admission":0,"duplicate_continuation":0,"stale_recovery":0,"unfinished_run":0,"failed_scenarios":0},"status":"keep","description":"Add the reload tool-result continuation guard to composition coverage; coverage rose from 11 to 12 with zero lifecycle violations.","timestamp":1787209144464,"segment":10,"confidence":4,"asi":{"hypothesis":"The existing reload regression test closes the remaining arbitrary-tool-result re-arm boundary without changing production policy or weakening assertions.","result":"The tagged matrix now executes twelve real scenarios; all passed with zero lifecycle violations and zero duplicate-continuation failures, while the full composition file and typecheck remained green."}}
{"run":44,"commit":"09aed03","metric":13,"metrics":{"lifecycle_violations":0,"duplicate_admission":0,"duplicate_continuation":0,"stale_recovery":0,"unfinished_run":0,"failed_scenarios":0},"status":"keep","description":"Add cancelled-run queued host-event invalidation to composition coverage; coverage rose from 12 to 13 with zero lifecycle violations.","timestamp":1787209211124,"segment":10,"confidence":3.3333333333333335,"asi":{"hypothesis":"The existing queued-host-event regression test probes stale recovery after cancellation and replacement, a distinct boundary from stale settlement and reload guards.","result":"The tagged matrix now executes thirteen real scenarios; all passed with zero lifecycle violations and zero stale-recovery failures, while the full composition file and typecheck remained green."}}
{"run":45,"commit":"769f2b2","metric":14,"metrics":{"lifecycle_violations":0,"duplicate_admission":0,"duplicate_continuation":0,"stale_recovery":0,"unfinished_run":0,"failed_scenarios":0},"status":"keep","description":"Add in-flight cancellation completion to composition coverage; coverage rose from 13 to 14 with zero lifecycle violations.","timestamp":1787209282462,"segment":10,"confidence":3,"asi":{"hypothesis":"The existing in-flight stream cancellation regression test probes whether late completion can reactivate a cancelled route, distinct from queued-event invalidation.","result":"The tagged matrix now executes fourteen real scenarios; all passed with zero lifecycle violations and zero unfinished-run failures, while the full composition file and typecheck remained green."}}
{"run":46,"commit":"103a8b3","metric":15,"metrics":{"lifecycle_violations":0,"duplicate_admission":0,"duplicate_continuation":0,"stale_recovery":0,"unfinished_run":0,"failed_scenarios":0},"status":"keep","description":"Add cancelled-evaluation reload protection to composition coverage; coverage rose from 14 to 15 with zero lifecycle violations.","timestamp":1787209345226,"segment":10,"confidence":3.5,"asi":{"hypothesis":"The existing cancellation-and-reload regression test probes whether a late assessment decision can revive a replaced evaluation, distinct from stream and queued-event races.","result":"The tagged matrix now executes fifteen real scenarios; all passed with zero lifecycle violations and zero stale-recovery failures, while the full composition file and typecheck remained green."}}
{"run":47,"commit":"94ff65c","metric":16,"metrics":{"lifecycle_violations":0,"duplicate_admission":0,"duplicate_continuation":0,"stale_recovery":0,"unfinished_run":0,"failed_scenarios":0},"status":"keep","description":"Add aborted-idle recovery before compaction to composition coverage; coverage rose from 15 to 16 with zero lifecycle violations.","timestamp":1787209413361,"segment":10,"confidence":4,"asi":{"hypothesis":"The existing aborted-idle recovery regression test exercises recovery, compaction, todo, mutation, and handoff as one integrated lifecycle boundary.","result":"The tagged matrix now executes sixteen real scenarios; all passed with zero lifecycle violations and zero stale-recovery failures, while the full composition file and typecheck remained green."}}
{"run":48,"commit":"de450be","metric":17,"metrics":{"lifecycle_violations":0,"duplicate_admission":0,"duplicate_continuation":0,"stale_recovery":0,"unfinished_run":0,"failed_scenarios":0},"status":"keep","description":"Add empty stale agent-end suppression to composition coverage; coverage rose from 16 to 17 with zero lifecycle violations.","timestamp":1787209494456,"segment":10,"confidence":3.6,"asi":{"hypothesis":"The existing empty-stale-agent-end regression test isolates a host-event fact that can otherwise reset a replacement run, complementing the broader recovery scenarios.","result":"The tagged matrix now executes seventeen real scenarios; all passed with zero lifecycle violations and zero stale-recovery failures, while the full composition file and typecheck remained green."}}
{"run":49,"commit":"3e92421","metric":18,"metrics":{"lifecycle_violations":0,"duplicate_admission":0,"duplicate_continuation":0,"stale_recovery":0,"unfinished_run":0,"failed_scenarios":0},"status":"keep","description":"Add stale-todo planning checkpoint replay to composition coverage; coverage rose from 17 to 18 with zero lifecycle violations.","timestamp":1787209572093,"segment":10,"confidence":3.3333333333333335,"asi":{"hypothesis":"The existing stale-todo replay regression test exercises repeated recovery until a valid todo replaces stale state, complementing the aborted-idle and stale-event cases.","result":"The tagged matrix now executes eighteen real scenarios; all passed with zero lifecycle violations and zero stale-recovery failures, while the full composition file and typecheck remained green."}}
{"run":50,"commit":"9a7e753","metric":19,"metrics":{"lifecycle_violations":0,"duplicate_admission":0,"duplicate_continuation":0,"stale_recovery":0,"unfinished_run":0,"failed_scenarios":0},"status":"keep","description":"Add planner compaction interruption replay to composition coverage; coverage rose from 18 to 19 with zero lifecycle violations.","timestamp":1787209656048,"segment":10,"confidence":3.6666666666666665,"asi":{"hypothesis":"The existing planner-compaction replay regression test covers initial-request interruption recovery, distinct from stale-todo replay and durable-todo continuation.","result":"The tagged matrix now executes nineteen real scenarios; all passed with zero lifecycle violations and zero stale-recovery failures, while the full composition file and typecheck remained green."}}
{"run":51,"commit":"4bf7153","metric":20,"metrics":{"lifecycle_violations":0,"duplicate_admission":0,"duplicate_continuation":0,"stale_recovery":0,"unfinished_run":0,"failed_scenarios":0},"status":"keep","description":"Add bounded planner-pressure retry failure coverage; coverage rose from 19 to 20 with zero lifecycle violations.","timestamp":1787209742381,"segment":10,"confidence":4,"asi":{"hypothesis":"The existing planner-pressure regression test verifies one compaction retry then fail-closed termination, preventing an unbounded recovery loop or unfinished route.","result":"The tagged matrix now executes twenty real scenarios; all passed with zero lifecycle violations and zero unfinished-run failures, while the full composition file and typecheck remained green."}}
