{"type":"config","name":"context-estimator-safety-margin","metricName":"weighted_error_ppm","metricUnit":"ppm","bestDirection":"lower"}
{"run":1,"commit":"working","metric":13612,"metrics":{"underestimation_rate_ppm":808227,"p95_under_tokens":693,"p95_over_tokens":251,"threshold_false_positives":1,"threshold_false_negatives":1,"holdout_weighted_error_ppm":19523,"holdout_underestimation_rate_ppm":811083,"holdout_p95_under_tokens":911,"holdout_p95_over_tokens":244,"holdout_threshold_false_positives":0,"holdout_threshold_false_negatives":1},"status":"keep","description":"Context baseline with no added safety margin.","timestamp":1787200792000,"segment":0,"confidence":null,"asi":{"hypothesis":"The existing estimator is the control; measure asymmetric underestimation loss before changing production behavior.","checks":"executor context tests and typecheck passed"}}
{"run":2,"commit":"working","metric":10498,"metrics":{"underestimation_rate_ppm":238188,"p95_under_tokens":565,"p95_over_tokens":379,"threshold_false_positives":1,"threshold_false_negatives":1,"holdout_weighted_error_ppm":16207,"holdout_underestimation_rate_ppm":272040,"holdout_p95_under_tokens":783,"holdout_p95_over_tokens":372,"holdout_threshold_false_positives":0,"holdout_threshold_false_negatives":0},"status":"keep","description":"Add a 128-token estimate margin.","timestamp":1787200793000,"segment":0,"confidence":null,"asi":{"hypothesis":"A small fixed margin should reduce provider-serialization underestimation without changing the estimator shape.","result":"Primary and holdout loss improved; holdout threshold misses reached zero."}}
{"run":3,"commit":"working","metric":9559,"metrics":{"underestimation_rate_ppm":116454,"p95_under_tokens":437,"p95_over_tokens":507,"threshold_false_positives":3,"threshold_false_negatives":1,"holdout_weighted_error_ppm":14836,"holdout_underestimation_rate_ppm":156171,"holdout_p95_under_tokens":655,"holdout_p95_over_tokens":500,"holdout_threshold_false_positives":0,"holdout_threshold_false_negatives":0},"status":"keep","description":"Increase the fixed estimate margin to 256 tokens.","timestamp":1787200794000,"segment":0,"confidence":null,"asi":{"hypothesis":"A larger margin may remove more residual underestimation while keeping early-compaction mistakes bounded.","result":"Primary loss improved again and holdout threshold misses stayed at zero; three training threshold false positives were observed."}}
{"run":4,"commit":"working","metric":9286,"metrics":{"underestimation_rate_ppm":86715,"p95_under_tokens":309,"p95_over_tokens":635,"threshold_false_positives":3,"threshold_false_negatives":0,"holdout_weighted_error_ppm":14356,"holdout_underestimation_rate_ppm":113350,"holdout_p95_under_tokens":527,"holdout_p95_over_tokens":628,"holdout_threshold_false_positives":0,"holdout_threshold_false_negatives":0},"status":"keep","description":"Increase the fixed estimate margin to 384 tokens.","timestamp":1787200795000,"segment":0,"confidence":null,"asi":{"hypothesis":"384 tokens may cover the remaining request-shape residual at the stock threshold.","result":"Best optimization score among accepted safety candidates, zero threshold misses on both splits, and three training false positives."}}
{"run":5,"commit":"working","metric":9404,"metrics":{"underestimation_rate_ppm":68371,"p95_under_tokens":181,"p95_over_tokens":763,"threshold_false_positives":5,"threshold_false_negatives":0,"holdout_weighted_error_ppm":14294,"holdout_underestimation_rate_ppm":93199,"holdout_p95_under_tokens":399,"holdout_p95_over_tokens":756,"holdout_threshold_false_positives":0,"holdout_threshold_false_negatives":0},"status":"discard","description":"Increase the fixed estimate margin to 512 tokens.","timestamp":1787200796000,"segment":0,"confidence":null,"asi":{"hypothesis":"A larger margin could further reduce underestimation.","rollback_reason":"It exceeded the three false-positive safety cap and was worse than 384 on the optimization split.","next_action_hint":"Keep 384 and validate it in the full executor and integration suites."}}
{"type":"config","name":"automatic-admission-classifier","metricName":"weighted_error","metricUnit":"cases","bestDirection":"lower"}
{"run":6,"commit":"working","metric":5,"metrics":{"false_negatives":1,"false_positives":0,"accuracy_ppm":972222,"holdout_weighted_error":1,"holdout_false_negatives":0,"holdout_false_positives":1,"holdout_accuracy_ppm":916667},"status":"keep","description":"Admission baseline against the frozen synthetic corpus.","timestamp":1787200797000,"segment":1,"confidence":null,"asi":{"hypothesis":"The existing classifier should establish the policy error profile before changing regexes.","result":"One hyphenated substantial-work false negative and one direct negation false positive."}}
{"run":7,"commit":"working","metric":0,"metrics":{"false_negatives":0,"false_positives":0,"accuracy_ppm":1000000,"holdout_weighted_error":0,"holdout_false_negatives":0,"holdout_false_positives":0,"holdout_accuracy_ppm":1000000},"status":"keep","description":"Cover hyphenated multiple-concerns work and changing/modifying/editing/writing negation forms.","timestamp":1787200798000,"segment":1,"confidence":null,"asi":{"hypothesis":"Normalize the two observed lexical edge cases without broadening the substantial-work policy.","result":"Zero optimization and holdout errors; focused admission tests and typecheck passed."}}
{"type":"config","name":"prewalk-autoresearch-composition","metricName":"lifecycle_violations","metricUnit":"violations","bestDirection":"lower"}
{"run":8,"commit":"working","metric":0,"metrics":{"duplicate_admission":0,"duplicate_continuation":0,"stale_recovery":0,"unfinished_run":0},"status":"keep","description":"Stock-Pi composition baseline with an Autoresearch-shaped extension follow-up.","timestamp":1787200799000,"segment":2,"confidence":null,"asi":{"hypothesis":"The existing extension-source guard should prevent an Autoresearch follow-up from entering automatic Prewalk assessment.","result":"Real agent-loop characterization passed with one provider turn and no prewalk_assess entry."}}
{"run":9,"commit":"working","metric":1,"metrics":{"duplicate_admission":0,"duplicate_continuation":0,"stale_recovery":0,"unfinished_run":0},"status":"crash","description":"Remove the extension-source guard as a composition candidate.","timestamp":1787200800000,"segment":2,"confidence":null,"asi":{"hypothesis":"Allowing extension-sourced messages into automatic admission might simplify composition.","rollback_reason":"The integration test immediately admitted the Autoresearch-shaped follow-up and persisted prewalk_assess.","next_action_hint":"Restore the fail-closed guard; do not move composition policy into host correlation."}}
{"type":"config","name":"Context estimate margin rerun","metricName":"weighted_error_ppm","metricUnit":"","bestDirection":"lower"}
{"run":10,"commit":"d8c0254","metric":9286,"metrics":{"underestimation_rate_ppm":86715,"p95_under_tokens":309,"p95_over_tokens":635,"reserve_breach_underestimates":0,"threshold_false_positives":3,"threshold_false_negatives":0,"rows":3598,"models":4,"holdout_weighted_error_ppm":14356,"holdout_underestimation_rate_ppm":113350,"holdout_p95_under_tokens":527,"holdout_p95_over_tokens":628,"holdout_reserve_breach_underestimates":0,"holdout_threshold_false_positives":0,"holdout_threshold_false_negatives":0,"holdout_rows":397,"holdout_models":4},"status":"keep","description":"Tool-driven baseline confirming the accepted 384-token context-estimate margin.","timestamp":1787202507592,"segment":3,"confidence":null,"asi":{"hypothesis":"The accepted 384-token margin will reproduce the frozen optimization and holdout scores with zero threshold false negatives under the actual Autoresearch runner.","result":"The exact frozen metrics reproduced and all backpressure checks passed."}}
{"run":11,"commit":"d8c0254","metric":13612,"metrics":{"underestimation_rate_ppm":808227,"p95_under_tokens":693,"p95_over_tokens":251,"reserve_breach_underestimates":0,"threshold_false_positives":1,"threshold_false_negatives":0,"rows":3598,"models":4,"holdout_weighted_error_ppm":19523,"holdout_underestimation_rate_ppm":811083,"holdout_p95_under_tokens":911,"holdout_p95_over_tokens":244,"holdout_reserve_breach_underestimates":0,"holdout_threshold_false_positives":0,"holdout_threshold_false_negatives":1,"holdout_rows":397,"holdout_models":4},"status":"checks_failed","description":"Context candidate with no added safety margin; reproduced the expected worse score and failed the exact-margin regression tests.","timestamp":1787202527756,"segment":3,"confidence":null,"asi":{"hypothesis":"Removing the margin would show whether the accepted calibration still beats the stock estimator under the active runner.","rollback_reason":"The candidate worsened the primary and holdout scores and failed the focused tests because the expected 384-token safety behavior disappeared.","next_action_hint":"Let log_experiment restore the 384-token baseline, then test the 128-token candidate."}}
{"run":12,"commit":"d8c0254","metric":10498,"metrics":{"underestimation_rate_ppm":238188,"p95_under_tokens":565,"p95_over_tokens":379,"reserve_breach_underestimates":0,"threshold_false_positives":1,"threshold_false_negatives":0,"rows":3598,"models":4,"holdout_weighted_error_ppm":16207,"holdout_underestimation_rate_ppm":272040,"holdout_p95_under_tokens":783,"holdout_p95_over_tokens":372,"holdout_reserve_breach_underestimates":0,"holdout_threshold_false_positives":0,"holdout_threshold_false_negatives":0,"holdout_rows":397,"holdout_models":4},"status":"checks_failed","description":"Context candidate with a 128-token safety margin; it improved on zero margin but remained worse than the accepted 384-token baseline and failed the exact-margin regression tests.","timestamp":1787202544728,"segment":3,"confidence":null,"asi":{"hypothesis":"A 128-token margin might preserve most of the safety improvement at lower early-compaction cost.","rollback_reason":"The candidate's optimization and holdout scores were both worse than 384, and the exact-margin checks rejected the candidate.","next_action_hint":"Let Autoresearch restore 384, then test 256 tokens."}}
{"run":13,"commit":"d8c0254","metric":9559,"metrics":{"underestimation_rate_ppm":116454,"p95_under_tokens":437,"p95_over_tokens":507,"reserve_breach_underestimates":0,"threshold_false_positives":3,"threshold_false_negatives":0,"rows":3598,"models":4,"holdout_weighted_error_ppm":14836,"holdout_underestimation_rate_ppm":156171,"holdout_p95_under_tokens":655,"holdout_p95_over_tokens":500,"holdout_reserve_breach_underestimates":0,"holdout_threshold_false_positives":0,"holdout_threshold_false_negatives":0,"holdout_rows":397,"holdout_models":4},"status":"checks_failed","description":"Context candidate with a 256-token safety margin; it improved over smaller margins but remained worse than 384 and failed the exact-margin regression tests.","timestamp":1787202567977,"segment":3,"confidence":null,"asi":{"hypothesis":"A 256-token margin might approach the accepted loss while avoiding unnecessary early compaction.","rollback_reason":"The candidate remained worse on both optimization and holdout scores and failed the focused tests that pin the accepted 384-token behavior.","next_action_hint":"Let Autoresearch restore 384, then test 512 tokens for the safety-cap tradeoff."}}
{"run":14,"commit":"d8c0254","metric":9404,"metrics":{"underestimation_rate_ppm":68371,"p95_under_tokens":181,"p95_over_tokens":763,"reserve_breach_underestimates":0,"threshold_false_positives":5,"threshold_false_negatives":0,"rows":3598,"models":4,"holdout_weighted_error_ppm":14294,"holdout_underestimation_rate_ppm":93199,"holdout_p95_under_tokens":399,"holdout_p95_over_tokens":756,"holdout_reserve_breach_underestimates":0,"holdout_threshold_false_positives":0,"holdout_threshold_false_negatives":0,"holdout_rows":397,"holdout_models":4},"status":"checks_failed","description":"Context candidate with a 512-token safety margin; it reduced underestimation but exceeded the false-positive safety cap, was worse than 384 on optimization, and failed exact-margin tests.","timestamp":1787202584869,"segment":3,"confidence":null,"asi":{"hypothesis":"A 512-token margin might reduce underestimation enough to justify its early-compaction cost.","rollback_reason":"The candidate had five optimization threshold false positives against a cap of three, a worse primary score than 384, and failed the exact-margin tests.","next_action_hint":"Keep the restored 384-token margin and move to the admission segment."}}
{"type":"config","name":"Automatic admission rerun","metricName":"weighted_error","metricUnit":"","bestDirection":"lower"}
{"run":15,"commit":"d8247d1","metric":0,"metrics":{"false_negatives":0,"false_positives":0,"accuracy_ppm":1000000,"rows":36,"holdout_weighted_error":0,"holdout_false_negatives":0,"holdout_false_positives":0,"holdout_accuracy_ppm":1000000,"holdout_rows":12},"status":"keep","description":"Tool-driven baseline confirming the accepted automatic-admission classifier.","timestamp":1787202616233,"segment":4,"confidence":null,"asi":{"hypothesis":"The accepted admission regexes will reproduce zero optimization and holdout errors under the actual Autoresearch runner.","result":"The exact frozen admission metrics reproduced and all active-segment checks passed."}}
{"run":16,"commit":"d8247d1","metric":5,"metrics":{"false_negatives":1,"false_positives":0,"accuracy_ppm":972222,"rows":36,"holdout_weighted_error":1,"holdout_false_negatives":0,"holdout_false_positives":1,"holdout_accuracy_ppm":916667,"holdout_rows":12},"status":"checks_failed","description":"Former automatic-admission classifier; scorer reproduced 5 optimization and 1 holdout weighted errors, while the wrapper's default checks missed the segment override and a manual admission check found the two expected regression failures.","timestamp":1787202665069,"segment":4,"confidence":null,"asi":{"hypothesis":"The former regexes should reproduce the known hyphenated-work miss and direct negation false positive.","rollback_reason":"The candidate failed the actual admission test file in two cases; the initial wrapper check was invalid because AR_SEGMENT was not inherited by the separate checks process.","next_action_hint":"Let Autoresearch restore the accepted regexes and use an explicit in-command admission check for the next baseline."}}
{"run":17,"commit":"a7d78c5","metric":0,"metrics":{"false_negatives":0,"false_positives":0,"accuracy_ppm":1000000,"rows":36,"holdout_weighted_error":0,"holdout_false_negatives":0,"holdout_false_positives":0,"holdout_accuracy_ppm":1000000,"holdout_rows":12},"status":"keep","description":"Post-rollback admission baseline with the segment-specific checks explicitly executed in-command.","timestamp":1787202688564,"segment":4,"confidence":null,"asi":{"hypothesis":"The accepted regexes and the exact admission test file should pass after the former-classifier rollback.","result":"All 16 admission tests, the frozen optimization scorer, the holdout scorer, and typecheck passed with zero errors."}}
{"type":"config","name":"Prewalk Autoresearch composition rerun","metricName":"lifecycle_violations","metricUnit":"","bestDirection":"lower"}
{"run":18,"commit":"5b73213","metric":0,"metrics":{"duplicate_admission":0,"duplicate_continuation":0,"stale_recovery":0,"unfinished_run":0},"status":"keep","description":"Tool-driven composition baseline with the extension-source guard retained.","timestamp":1787202714799,"segment":5,"confidence":null,"asi":{"hypothesis":"The existing fail-closed extension-source guard will keep an Autoresearch-shaped follow-up out of automatic Prewalk without lifecycle violations.","result":"The composition test and explicit segment checks passed with zero lifecycle violations."}}
{"run":19,"commit":"5b73213","metric":1,"metrics":{"duplicate_admission":0,"duplicate_continuation":0,"stale_recovery":0,"unfinished_run":0},"status":"crash","description":"Composition candidate removing the extension-source guard; the real agent-loop test admitted the Autoresearch-shaped follow-up and failed.","timestamp":1787202736786,"segment":5,"confidence":null,"asi":{"hypothesis":"Allowing extension-sourced messages into automatic admission might simplify composition.","rollback_reason":"The composition test persisted a prewalk_assess entry for the extension follow-up, causing one lifecycle violation and a failing test.","next_action_hint":"Restore the fail-closed extension-source guard; do not move composition policy into host-event correlation."}}
{"run":20,"commit":"5b73213","metric":0,"metrics":{"duplicate_admission":0,"duplicate_continuation":0,"stale_recovery":0,"unfinished_run":0},"status":"discard","description":"Final no-change composition control; the accepted fail-closed boundary reproduced zero lifecycle violations without overfitting or adding production behavior.","timestamp":1787203080759,"segment":5,"confidence":null,"asi":{"hypothesis":"With all production candidates exhausted, the accepted extension-source guard should remain the stable composition boundary under a fresh runner invocation.","rollback_reason":"The control matched the existing best metric rather than improving it; no source change was proposed or retained.","next_action_hint":"Stop at the 20-run campaign ceiling and preserve the accepted context, admission, and composition decisions."}}
{"type":"config","name":"Context margin clean search","metricName":"weighted_error_ppm","metricUnit":"","bestDirection":"lower"}
{"run":21,"commit":"dcaeda9","metric":9163,"metrics":{"underestimation_rate_ppm":84552,"p95_under_tokens":338,"p95_over_tokens":665,"reserve_breach_underestimates":0,"threshold_false_positives":3,"threshold_false_negatives":0,"rows":2803,"models":4},"status":"keep","description":"Clean context-search baseline at the accepted 384-token margin on the train split.","timestamp":1787204885890,"segment":6,"confidence":null,"asi":{"hypothesis":"The non-mutating margin evaluator should reproduce the accepted 384-token context behavior on the frozen train split while leaving production and exact-margin tests untouched.","result":"Train baseline measured 9163 ppm, the scorer passed syntax and cross-checks, and the active checks passed."}}
{"run":22,"commit":"dcaeda9","metric":9205,"metrics":{"underestimation_rate_ppm":103104,"p95_under_tokens":434,"p95_over_tokens":569,"reserve_breach_underestimates":0,"threshold_false_positives":3,"threshold_false_negatives":0,"rows":2803,"models":4},"status":"discard","description":"Train-only 288-token context margin; it was worse than the 384 baseline without improving threshold safety.","timestamp":1787204905821,"segment":6,"confidence":null,"asi":{"hypothesis":"A smaller nearby margin might reduce overestimation while retaining enough protection against underestimation.","rollback_reason":"Train weighted error rose from 9163 to 9205 and no threshold metric improved.","next_action_hint":"Keep the clean 384 baseline and test the next nearby margin."}}
{"run":23,"commit":"dcaeda9","metric":9164,"metrics":{"underestimation_rate_ppm":96682,"p95_under_tokens":402,"p95_over_tokens":601,"reserve_breach_underestimates":0,"threshold_false_positives":3,"threshold_false_negatives":0,"rows":2803,"models":4},"status":"discard","description":"Train-only 320-token context margin; it was a slight regression against 384 and did not improve safety counts.","timestamp":1787204925537,"segment":6,"confidence":null,"asi":{"hypothesis":"A 320-token margin might be a lower-cost near-optimum than 384.","rollback_reason":"Train weighted error was 9164 versus the 384 baseline at 9163, with identical threshold counts.","next_action_hint":"Discard the candidate and test 352."}}
{"run":24,"commit":"f626dd1","metric":9157,"metrics":{"underestimation_rate_ppm":91331,"p95_under_tokens":370,"p95_over_tokens":633,"reserve_breach_underestimates":0,"threshold_false_positives":3,"threshold_false_negatives":0,"rows":2803,"models":4},"status":"keep","description":"Train-only 352-token context margin; it is the current train leader by 6 ppm, but the gain is far below the 1% promotion threshold and does not change production.","timestamp":1787204945963,"segment":6,"confidence":1.7142857142857142,"asi":{"hypothesis":"A 352-token margin may be a nearby train optimum while preserving the existing threshold safety counts.","result":"Train error improved from 9163 to 9157, only 0.07%; retain as a research finalist, not as a production change, pending validation."}}
{"run":25,"commit":"f626dd1","metric":9183,"metrics":{"underestimation_rate_ppm":81341,"p95_under_tokens":306,"p95_over_tokens":697,"reserve_breach_underestimates":0,"threshold_false_positives":3,"threshold_false_negatives":0,"rows":2803,"models":4},"status":"discard","description":"Train-only 416-token context margin; it was worse than both the 352 research finalist and the accepted 384 production baseline.","timestamp":1787204967994,"segment":6,"confidence":0.8571428571428571,"asi":{"hypothesis":"A modestly larger margin might reduce residual underestimation without crossing the safety cap.","rollback_reason":"Train weighted error rose to 9183, with no threshold safety improvement over the 352 finalist.","next_action_hint":"Discard and test 448."}}
