{"run":130,"commit":"ce9f678","metric":99,"metrics":{"lifecycle_violations":0,"duplicate_admission":0,"duplicate_continuation":0,"stale_recovery":0,"unfinished_run":0,"failed_scenarios":0},"status":"keep","description":"Add smaller-executor watchdog coverage; coverage rose from 98 to 99 with zero lifecycle violations.","timestamp":1787222790952,"segment":10,"confidence":3.9565217391304346,"asi":{"hypothesis":"A smaller executor context window is accepted and its watchdog handles pressure safely, rather than using the planner window or leaving the route unprotected.","result":"The tagged matrix now executes ninety-nine real scenarios; all passed with zero lifecycle violations, zero duplicate continuations, and zero unfinished runs. The focused composition checks, typecheck, and complete extension.test.ts module (152 tests) all passed.","consistency_check":"The exact test title appears once in extension.test.ts and once as its scorer pattern; the new scenario ID appears once. Existing compaction-disabled, preflight-pressure, and retry-boundary cases remain distinct.","scope_check":"The diff adds one distinct existing regression to the frozen matrix only; no production behavior, test assertions, labels, or scorer logic changed."}}
{"run":131,"commit":"b0e0a93","metric":100,"metrics":{"lifecycle_violations":0,"duplicate_admission":0,"duplicate_continuation":0,"stale_recovery":0,"unfinished_run":0,"failed_scenarios":0},"status":"keep","description":"Add incomplete analytics-cleanup retry coverage; coverage rose from 99 to 100 with zero lifecycle violations.","timestamp":1787223000267,"segment":10,"confidence":4,"asi":{"hypothesis":"Partial analytics reset cleanup is reported and retried idempotently, without issuing a second reset or leaving stale generations unresolved.","result":"The tagged matrix now executes one hundred real scenarios; all passed with zero lifecycle violations, zero stale-recovery failures, and zero unfinished runs. The focused composition checks, typecheck, and complete extension.test.ts module (152 tests) all passed.","consistency_check":"The exact test title appears once in extension.test.ts and once as its scorer pattern; the new scenario ID appears once. Existing generation-reset and finalization-recovery boundaries remain distinct.","scope_check":"The diff adds one distinct existing regression to the frozen matrix only; no production behavior, test assertions, labels, or scorer logic changed."}}
{"run":132,"commit":"42fa16f","metric":101,"metrics":{"lifecycle_violations":0,"duplicate_admission":0,"duplicate_continuation":0,"stale_recovery":0,"unfinished_run":0,"failed_scenarios":0},"status":"keep","description":"Add stale tool-query replacement coverage; coverage rose from 100 to 101 with zero lifecycle violations.","timestamp":1787223218546,"segment":10,"confidence":3.9574468085106385,"asi":{"hypothesis":"A queried tool result from the cancelled run must not be persisted before a replacement run claims the same tool ID, preventing stale evidence from binding to the new trajectory.","result":"The tagged matrix now executes one hundred one real scenarios; all passed with zero lifecycle violations, zero stale-recovery failures, and zero duplicate continuations. The focused composition checks, typecheck, and complete extension.test.ts module (152 tests) all passed.","consistency_check":"The exact test title appears once in extension.test.ts and once as its scorer pattern; the new scenario ID appears once. Existing stale-settlement and cancellation-race boundaries remain distinct.","scope_check":"The diff adds one distinct existing regression to the frozen matrix only; no production behavior, test assertions, labels, or scorer logic changed."}}
{"run":133,"commit":"704364d","metric":102,"metrics":{"lifecycle_violations":0,"duplicate_admission":0,"duplicate_continuation":0,"stale_recovery":0,"unfinished_run":0,"failed_scenarios":0},"status":"keep","description":"Add active-capture replacement coverage; coverage rose from 101 to 102 with zero lifecycle violations.","timestamp":1787223428174,"segment":10,"confidence":3.9166666666666665,"asi":{"hypothesis":"Captured active message identity and both tool-claim fallbacks remain owned by the cancelled run, so repeated IDs cannot rebind to the replacement trajectory.","result":"The tagged matrix now executes one hundred two real scenarios; all passed with zero lifecycle violations, zero stale-recovery failures, and zero duplicate continuations. The focused composition checks, typecheck, and complete extension.test.ts module (152 tests) all passed.","consistency_check":"The exact test title appears once in extension.test.ts and once as its scorer pattern; the new scenario ID appears once. The existing stale-tool-query and stale-settlement cases remain distinct.","scope_check":"The diff adds one distinct existing regression to the frozen matrix only; no production behavior, test assertions, labels, or scorer logic changed."}}
{"run":134,"commit":"a1580aa","metric":103,"metrics":{"lifecycle_violations":0,"duplicate_admission":0,"duplicate_continuation":0,"stale_recovery":0,"unfinished_run":0,"failed_scenarios":0},"status":"keep","description":"Add oldest-settlement replacement coverage; coverage rose from 102 to 103 with zero lifecycle violations.","timestamp":1787223653124,"segment":10,"confidence":3.9583333333333335,"asi":{"hypothesis":"An older queued settlement message and its tool fallbacks remain owned by the cancelled run and cannot bind to the replacement trajectory.","result":"The tagged matrix now executes one hundred three real scenarios; all passed with zero lifecycle violations, zero stale-recovery failures, and zero duplicate continuations. The focused composition checks, typecheck, and complete extension.test.ts module (152 tests) all passed.","consistency_check":"The exact test title appears once in extension.test.ts and once as its scorer pattern; the new scenario ID appears once. Existing active-capture, stale-tool-query, and cancellation-race cases remain distinct.","scope_check":"The diff adds one distinct existing regression to the frozen matrix only; no production behavior, test assertions, labels, or scorer logic changed."}}
{"run":135,"commit":"03be4c2","metric":104,"metrics":{"lifecycle_violations":0,"duplicate_admission":0,"duplicate_continuation":0,"stale_recovery":0,"unfinished_run":0,"failed_scenarios":0},"status":"keep","description":"Add first-known agent-end ordering coverage; coverage rose from 103 to 104 with zero lifecycle violations.","timestamp":1787223867133,"segment":10,"confidence":4,"asi":{"hypothesis":"The first directly known agent-end message wins while earlier unknown messages are skipped, preserving ownership and continuation ordering across replacement runs.","result":"The tagged matrix now executes one hundred four real scenarios; all passed with zero lifecycle violations, zero stale-recovery failures, and zero duplicate continuations. The focused composition checks, typecheck, and complete extension.test.ts module (152 tests) all passed.","consistency_check":"The exact test title appears once in extension.test.ts and once as its scorer pattern; the new scenario ID appears once. Existing active-capture, oldest-settlement, and stale-tool-query boundaries remain distinct.","scope_check":"The diff adds one distinct existing regression to the frozen matrix only; no production behavior, test assertions, labels, or scorer logic changed."}}
{"run":136,"commit":"4ab7a2c","metric":105,"metrics":{"lifecycle_violations":0,"duplicate_admission":0,"duplicate_continuation":0,"stale_recovery":0,"unfinished_run":0,"failed_scenarios":0},"status":"keep","description":"Add explicit-unowned ordering coverage; coverage rose from 104 to 105 with zero lifecycle violations.","timestamp":1787224102843,"segment":10,"confidence":3.9591836734693877,"asi":{"hypothesis":"Explicit-unowned captures and direct-unowned agent-end markers preserve FIFO ownership across replacement, so stale evidence cannot satisfy the new run.","result":"The tagged matrix now executes one hundred five real scenarios; all passed with zero lifecycle violations, zero stale-recovery failures, and zero duplicate continuations. The focused composition checks, typecheck, and complete extension.test.ts module (152 tests) all passed.","consistency_check":"The exact test title appears once in extension.test.ts and once as its scorer pattern; the new scenario ID appears once. Existing first-known, active-capture, oldest-settlement, and stale-tool-query cases remain distinct.","scope_check":"The diff adds one distinct existing regression to the frozen matrix only; no production behavior, test assertions, labels, or scorer logic changed."}}
{"run":137,"commit":"9315e00","metric":106,"metrics":{"lifecycle_violations":0,"duplicate_admission":0,"duplicate_continuation":0,"stale_recovery":0,"unfinished_run":0,"failed_scenarios":0},"status":"keep","description":"Add bounded tool-ID retention coverage; coverage rose from 105 to 106 with zero lifecycle violations.","timestamp":1787224375741,"segment":10,"confidence":3.92,"asi":{"hypothesis":"Retained tool IDs remain owned and cannot rebind after replacement until the oldest entry is evicted; the 513th insertion permits the expected rebinding.","result":"The tagged matrix now executes one hundred six real scenarios; all passed with zero lifecycle violations, zero stale-recovery failures, and zero duplicate continuations. The focused composition checks, typecheck, and complete extension.test.ts module (152 tests) all passed.","consistency_check":"The exact test title appears once in extension.test.ts and once as its scorer pattern; the new scenario ID appears once. Existing unowned-ordering, stale-tool-query, and capture-replacement boundaries remain distinct.","scope_check":"The diff adds one distinct existing regression to the frozen matrix only; no production behavior, test assertions, labels, or scorer logic changed."}}
{"run":138,"commit":"ac120ac","metric":107,"metrics":{"lifecycle_violations":0,"duplicate_admission":0,"duplicate_continuation":0,"stale_recovery":0,"unfinished_run":0,"failed_scenarios":0},"status":"keep","description":"Add bounded message-key retention coverage; coverage rose from 106 to 107 with zero lifecycle violations.","timestamp":1787224655770,"segment":10,"confidence":3.96,"asi":{"hypothesis":"Retained message keys remain owned and cannot rebind after replacement until the oldest key is evicted; the 513th distinct message permits the expected rebinding.","result":"The tagged matrix now executes one hundred seven real scenarios; all passed with zero lifecycle violations, zero stale-recovery failures, and zero duplicate continuations. The focused composition checks, typecheck, and complete extension.test.ts module (152 tests) all passed.","consistency_check":"The exact test title appears once in extension.test.ts and once as its scorer pattern; the new scenario ID appears once. This completes the complementary message-key/tool-ID retention pair without duplicating either test.","scope_check":"The diff adds one distinct existing regression to the frozen matrix only; no production behavior, test assertions, labels, or scorer logic changed."}}
{"type":"config","name":"Prewalk broader integration composition coverage","metricName":"scenarios","metricUnit":"","bestDirection":"higher"}
{"run":139,"commit":"49ae0ea","metric":107,"metrics":{"lifecycle_violations":0,"duplicate_admission":0,"duplicate_continuation":0,"stale_recovery":0,"unfinished_run":0,"failed_scenarios":0},"status":"keep","description":"Clean baseline for the broader integration-validation segment; the frozen composition matrix remains at 107 passing scenarios.","timestamp":1787226887230,"segment":11,"confidence":null,"asi":{"hypothesis":"The pre-candidate tree should reproduce the prior 107-scenario composition baseline before adding a distinct stock-Pi agent_end continuation flow.","result":"The clean matrix passed all 107 scenarios with zero lifecycle violations, zero duplicate admissions or continuations, zero stale-recovery failures, and zero unfinished runs; explicit composition checks and typecheck passed."}}
{"run":140,"commit":"0f7edb3","metric":108,"metrics":{"lifecycle_violations":0,"duplicate_admission":0,"duplicate_continuation":0,"stale_recovery":0,"unfinished_run":0,"failed_scenarios":0},"status":"keep","description":"Add one stock-Pi agent_end continuation around a real manual Prewalk handoff; composition coverage rose from 107 to 108 with zero lifecycle violations.","timestamp":1787227103443,"segment":11,"confidence":null,"asi":{"hypothesis":"An extension-owned agent_end follow-up can coexist with one manual planner-to-executor handoff when the follow-up is queued through Pi's supported followUp path, without duplicating the Prewalk route or leaving analytics unfinished.","result":"The new real stock-Pi scenario passed; the full agent-loop module (6 tests), existing composition module (3 tests), explicit composition checks, and typecheck all passed. The matrix now covers 108 scenarios with zero lifecycle violations, duplicate admissions, duplicate continuations, stale-recovery failures, or unfinished runs.","consistency_check":"The exact new test title appears once in test/integration/agent-loop.test.ts and once as the scorer pattern; the new scenario ID appears once. Existing extension-source, interactive-admission, and manual handoff coverage remain distinct.","scope_check":"The diff adds one integration characterization and its frozen-matrix/check wiring only; no production routing, correlation policy, existing assertion, label, or scorer semantics changed."}}
{"run":141,"commit":"d3d223c","metric":109,"metrics":{"lifecycle_violations":0,"duplicate_admission":0,"duplicate_continuation":0,"stale_recovery":0,"unfinished_run":0,"failed_scenarios":0},"status":"keep","description":"Add the stock-Pi cross-provider handoff flow; composition coverage rose from 108 to 109 with zero lifecycle violations.","timestamp":1787227336487,"segment":11,"confidence":2,"asi":{"hypothesis":"The public Agent-loop cross-provider route should preserve planner conversation, use the executor's own provider transport, and complete without duplicate continuation or unfinished analytics.","result":"The distinct cross-provider integration scenario passed; both affected integration files, explicit composition checks, and typecheck remained green. Coverage is now 109 scenarios with all lifecycle dimensions at zero.","consistency_check":"The exact test title appears once in test/integration/agent-loop.test.ts and once as the scorer pattern; the scenario ID appears once. The existing same-provider handoff and executor-attribution cases remain distinct.","scope_check":"The diff adds one existing integration scenario to the frozen matrix only; no production code, provider behavior, assertions, labels, or scorer semantics changed."}}
{"run":142,"commit":"0c986d0","metric":110,"metrics":{"lifecycle_violations":0,"duplicate_admission":0,"duplicate_continuation":0,"stale_recovery":0,"unfinished_run":0,"failed_scenarios":0},"status":"keep","description":"Add the public automatic-assessment flow; composition coverage rose from 109 to 110 with zero lifecycle violations.","timestamp":1787227554589,"segment":11,"confidence":3,"asi":{"hypothesis":"The real Agent-loop automatic admission path should execute one assessment and one planner continuation without duplicating admission or leaving a live run behind.","result":"The distinct automatic-assessment integration scenario passed; both affected integration files, explicit composition checks, and typecheck remained green. Coverage is now 110 scenarios with all lifecycle dimensions at zero.","consistency_check":"The exact test title appears once in test/integration/agent-loop.test.ts and once as the scorer pattern; the scenario ID appears once. Existing automatic-source, interactive-admission, and multi-turn assessment cases remain distinct.","scope_check":"The diff adds one existing public-runtime scenario to the frozen matrix only; no production routing, admission policy, assertions, labels, or scorer semantics changed."}}
{"run":143,"commit":"27133f0","metric":111,"metrics":{"lifecycle_violations":0,"duplicate_admission":0,"duplicate_continuation":0,"stale_recovery":0,"unfinished_run":0,"failed_scenarios":0},"status":"keep","description":"Add public planner-abort recovery through shutdown; composition coverage rose from 110 to 111 with zero lifecycle violations.","timestamp":1787227765809,"segment":11,"confidence":4,"asi":{"hypothesis":"A real stock-Pi aborted planner should recover its preserved reasoning, complete the same planner-to-executor route, and finalize analytics at shutdown without stale recovery or unfinished-run evidence.","result":"The distinct public recovery/shutdown scenario passed; both affected integration files, explicit composition checks, and typecheck remained green. Coverage is now 111 scenarios with every lifecycle dimension at zero.","consistency_check":"The exact test title appears once in test/integration/agent-loop.test.ts and once as the scorer pattern; the scenario ID appears once. Existing planner-recovery, compaction, and shutdown unit/integration boundaries remain distinct.","scope_check":"The diff adds one existing public-runtime scenario to the frozen matrix only; no production recovery policy, assertions, labels, or scorer semantics changed."}}
{"run":144,"commit":"d8be634","metric":112,"metrics":{"lifecycle_violations":0,"duplicate_admission":0,"duplicate_continuation":0,"stale_recovery":0,"unfinished_run":0,"failed_scenarios":0},"status":"keep","description":"Add public subagent launch coverage; composition coverage rose from 111 to 112 with zero lifecycle violations.","timestamp":1787227998812,"segment":11,"confidence":3.3333333333333335,"asi":{"hypothesis":"The public Prewalk runtime should preserve a delegated subagent launch and its planner todo transition before any child-provider boundary, without contaminating the parent lifecycle.","result":"The distinct public subagent scenario passed; both affected integration files, explicit composition checks, and typecheck remained green. Coverage is now 112 scenarios with every lifecycle dimension at zero.","consistency_check":"The exact test title appears once in test/integration/agent-loop.test.ts and once as the scorer pattern; the scenario ID appears once. Existing child mutation, child todo, and delegation analytics boundaries remain distinct.","scope_check":"The diff adds one existing public-runtime scenario to the frozen matrix only; no production delegation behavior, assertions, labels, or scorer semantics changed."}}
{"run":145,"commit":"d8be634","metric":0,"metrics":{"lifecycle_violations":0,"duplicate_admission":0,"duplicate_continuation":0,"stale_recovery":0,"unfinished_run":0,"failed_scenarios":1},"status":"crash","description":"Interrupted attempt to tag the existing tool-slate lifecycle test; no benchmark result was produced and the narrow candidate is not accepted.","timestamp":1787228395383,"segment":11,"confidence":3.3333333333333335,"asi":{"hypothesis":"The tool-slate lifecycle test might add a distinct integration boundary beyond the accepted stock-Pi public-runtime flows.","rollback_reason":"The experiment was interrupted before producing metrics, and on review the candidate is another narrow existing harness scenario rather than the broader integration evidence this campaign was created to gather.","next_action_hint":"Remove the unaccepted scorer entry, freeze the accepted 112-scenario result, and run focused plus repository-wide validation without adding more narrow scenarios."}}
{"run":146,"commit":"17118fc","metric":113,"metrics":{"lifecycle_violations":0,"duplicate_admission":0,"duplicate_continuation":0,"stale_recovery":0,"unfinished_run":0,"failed_scenarios":0},"status":"keep","description":"Add the real stock-Pi child-process boundary; composition coverage rose from 112 to 113 with zero lifecycle violations.","timestamp":1787229432045,"segment":11,"confidence":3,"asi":{"hypothesis":"An opted-in child launched through stock Pi and unmodified pi-subagents should preserve child-local model/tool policy, avoid inheriting the parent Prewalk todo surface, and shut down cleanly without lifecycle contamination.","result":"The distinct child-process integration scenario passed in the installed offline environment; explicit composition checks and typecheck passed. Coverage rose to 113 scenarios with all lifecycle dimensions at zero.","consistency_check":"The exact test title and scorer pattern each occur once; the new scenario ID is unique. Existing public subagent launch and child mutation/todo/analytics cases remain distinct.","scope_check":"Only one existing, broader integration flow was added to the frozen matrix; no production code, child policy, test assertions, labels, or scorer semantics changed.","environment_note":"This scenario is guarded by the locally installed unmodified pi-subagents package and stock Pi CLI; the full suite and benchmark environment both had those prerequisites."}}
